,address,categoryName,phone,postalCode,reviewsCount,state,title,website
87,"shop no 9, gemini bulilding, Marve Rd, near st judes school paly ground, Malad, Divya Park, Jankalyan Nagar, Malad West, Mumbai, Maharashtra 400097, India",Children's clothing store,+91 90049 06182,400097.0,25,Maharashtra,Lil fly kids and new born shop,
574,"Shop no. 2, Ground, Poonam Heights, 2, Swami Vivekananda Rd, Udyog Nagar, Goregaon West, Mumbai, Maharashtra 400104, India",Children's clothing store,+91 72300 34824,400104.0,0,Maharashtra,Mumkins Kids Wear,https://www.mumkins.in/
300,"Shop No.12/13, Super Market Arcade, Monghibai Rd, Navpada, Vile Parle East, Vile Parle, Mumbai, Maharashtra 400057, India",Children's clothing store,+91 83569 68545,400057.0,72,Maharashtra,Tinytots Kids Wear,
456,"Mehtab Lane, Shop No 7 Mehtab Lane, SG Barve Marg, opposite Royal Hotel, Kurla West, Mumbai, Maharashtra 400070, India",Children's clothing store,+91 98922 42054,400070.0,3,Maharashtra,Sweeties Kids,
578,"Shop No.24 O C C Gate No.5, Malad, New Mahakali Nagar, Malvani, Malad West, Mumbai, Maharashtra 400095, India",Children's clothing store,+91 83559 70065,400095.0,3,Maharashtra,Alif Kids Wear,
50,"Bhatti Pada Rd, Battipada, Bhandup West, Mumbai, Maharashtra 400078, India",Children's clothing store,+91 97571 13515,400078.0,40,Maharashtra,"Sundaram Readymade New Born And Kids Wear, Bhandup, Mumbai",
99,"Shop Number 8, Dev Chhaya Building, Bharucha Rd, Maratha Colony, Dahisar East, Mumbai, Maharashtra 400068, India",Children's clothing store,,400068.0,11,Maharashtra,Alpa Readymade Centre,
582,"vidhyarthi bhuvan, Main Carter Rd, Chinchpada, Borivali East, Mumbai, Maharashtra 400066, India",Children's clothing store,+91 98337 77235,400066.0,8,Maharashtra,Deep sagar/best ethnicwear in mumbai,https://www.indiamart.com/deep-sagar-mumbai/
45,"PRAMILA KUTIR, 3/504, New Mill Rd, nr. Mansi Aprt, BMC Colony, Kurla West, Kurla, Mumbai, Maharashtra 400070, India",Children's clothing store,+91 98213 29868,400070.0,0,Maharashtra,Baba Baby,
59,"Shop No - F, Kamani, PHOENIX MARKETCITY, 63, Lal Bahadur Shastri Marg, Patelwadi.Kurla, Kurla West, Kurla, Mumbai, Maharashtra 400070, India",Children's clothing store,+91 22 4971 1409,400070.0,87,Maharashtra,Mothercare,https://www.mothercare.in/
585,"Jagdish Shetty Rd, Kandivali, Ganesh Nagar, Kandivali West, Mumbai, Maharashtra 400067, India",Children's clothing store,,400067.0,3,Maharashtra,Sat saheb collection Children's wear,
39,"Shop Number 1, options fashion mall ,Vile Parle Shopping Centre Vaikunthal Mehta Road, Above Sahakari Bhandar, Vile Parle West, Juhu, Mumbai, Maharashtra 400049, India",Children's clothing store,,400049.0,52,Maharashtra,BABY BELL,
95,"Shukla Shopping Centre, Main Carter Rd, opposite 3rd carter road, Chinchpada, Borivali East, Mumbai, Maharashtra 400066, India",Children's clothing store,+91 98670 27450,400066.0,181,Maharashtra,The Little Rabbits,https://d-thelittlerabbits.dotpe.in/
306,"Shop No. 56, Ground Floor, City Centre Mall, Swami Vivekananda Rd, Divyapuri CHS, Shri Nagar, Goregaon West, Mumbai, Maharashtra 400104, India",Children's clothing store,+91 98207 27527,400104.0,13,Maharashtra,Teeny Tony kids wear,
588,"Plot no 14/k, 8, Rd Number 9, Govandi Slums, Govandi West, Baiganwadi, Govandi East, Mumbai, Maharashtra 400043, India",Children's clothing store,+91 74088 19578,400043.0,25,Maharashtra,Unique kids wear,
356,"Shop Number 4 SaI NIWAS Bagwe Compound, Tembipada Rd, Bhandup West, Mumbai, Maharashtra 400078, India",Children's clothing store,+91 93234 80992,400078.0,8,Maharashtra,Me Kids ( New Born & Children Fancy Cloths),
93,"Lalji Shopping Centre, 12-13, Swami Vivekananda Rd, Gyan Nagar, Borivali West, Mumbai, Maharashtra 400092, India",Children's clothing store,+91 22 2898 0883,400092.0,86,Maharashtra,Variety Kids,
628,"Shop No .6, Kenwood Hsg. Soc, opp. Hi.Point Restaurant, Lokhandwala Complex, Andheri West, Andheri, Mumbai, Maharashtra 400053, India",Children's clothing store,+91 22 2630 1662,400053.0,0,Maharashtra,Cool Kidz,
594,"8/9, Super Shopping Complex, SV Rd, Railway Colony, Andheri West, Mumbai, Maharashtra 400058, India",Children's clothing store,,400058.0,0,Maharashtra,Honesty Stores,
598,"Shop no 8, Pearl Platinum Ajit Glass, Off, Swami Vivekananda Rd, Oshiwara, Jogeshwari West, Mumbai, Maharashtra 400102, India",Children's clothing store,+91 98190 65486,400102.0,0,Maharashtra,Uptrend Fashion - Kids Wear,
24,"Unit no sf 244 second floor Infiniti, Infiniti Malad, Malad, Mindspace, Malad West, Mumbai, Maharashtra 400064, India",Children's clothing store,+91 81699 79061,400064.0,36,Maharashtra,Adidas Kids Infinity Malad,https://www.adidas.co.in/kids
56,"3R8M+R8C, Sita Mahal, Opposite Khar Telephone Exchange, Linking Road, khar West, Mumbai, Maharashtra 400052, India",Children's clothing store,+91 22 2605 7407,400052.0,45,Maharashtra,Choose-N-Cherry Kids Wear,
459,"Plot No 16 ,Line -A,Room no - 1 , Road no 2, Bhaji Market Shivaji Nagar, Govandi East, Mumbai, Maharashtra 400043, India",Children's clothing store,,400043.0,5,Maharashtra,HAPPY KIDz COLLECTION,
492,"Shop No 54, Malad Shopping Centre,Ground Floor, SV Rd, Malad West, Mumbai, Maharashtra 400064, India",Children's clothing store,+91 98213 33663,400064.0,53,Maharashtra,Panchratna Apparel,https://www.instagram.com/panchratna.apparel?r=nametag
398,"Q/10, Plot 43, Road No. 6, Govandi Slums, Govandi West, Sai Baba Nagar, Govandi East, Mumbai, Maharashtra 400043, India",Children's clothing store,,400043.0,0,Maharashtra,HABIB GARMENTS,
429,"santacruz(w, Shop No.2 , Rajnath Singh Estate, near Sambhaji Garden, Kothu Wadi, Mumbai, Maharashtra 400054, India",Children's clothing store,+91 99095 63278,400054.0,1,Maharashtra,Yukti Fashion -Girls Wear,https://www.yuktifashion.in/
428,"120, Fashqua, Deepchand Shopping Centre, Santacruz Railway Station Rd, Bajaj Wadi, Railway Colony, Santacruz (West), Mumbai, Maharashtra 400054, India",Children's clothing store,+91 97695 95325,400054.0,12,Maharashtra,Shavli,
399,"Shop No-6&7,Milan Commercial Centre,Anuradha Co-Op Society, 2 nr, Milan Subway, Santacruz (West), Mumbai, Maharashtra 400054, India",Children's clothing store,+91 98679 75780,400054.0,16,Maharashtra,Havok Clothings,http://www.havokclothing.com/
484,"Shop No 18, Moti Building, opp. Sodawala Lane, Roshan Nagar, Borivali, W, Mumbai, Maharashtra 400092, India",Children's clothing store,+91 86558 81724,400092.0,191,Maharashtra,Mumkins Kids Wear,http://www.mumkins.in/
402,"Shop No 5, Lal Bahadur Shastri Marg, Kurla West, Kurla, Mumbai, Maharashtra 400070, India",Children's clothing store,+91 98678 18725,400070.0,2,Maharashtra,G JUNIOR,
408,"Shop no. 19, Nilkanth Market, Mahatma Ghandhi Rd, & 20, Ghatkopar East, Mumbai, Maharashtra 400077, India",Children's clothing store,+91 87793 83195,400077.0,10,Maharashtra,Viraj Children's Wear,
410,"8th floor, Eudora building, 17th Rd, Khar, Khar West, Mumbai, Maharashtra 400052, India",Children's clothing store,+91 98206 88721,400052.0,23,Maharashtra,Balsara Boutique (Frills and Flowers),
411,"504, Linking Rd, opp. Mc. Donalds, Khar West, Mumbai, Maharashtra 400052, India",Children's clothing store,+91 93245 99564,400052.0,46,Maharashtra,Selection,
507,"108, Dr DG Palkar Rd, HSG. Society, Gorai 2, Borivali West, Mumbai, Maharashtra 400091, India",Children's clothing store,,400091.0,4,Maharashtra,Roop Darshan Exclusive Kids & Ladies Ready Made & Garments,
426,"Business Suites 9, SV Rd, Saraswat Nagar, Willingdon, Santacruz (West), Mumbai, Maharashtra 400054, India",Children's clothing store,+91 77388 21102,400054.0,57,Maharashtra,Vern Kids from the House of Telon India,https://telonindia.com/
413,"3. 12/36, Kurla W Sta Rd, Brahmanwadi, Kurla, Mumbai, Maharashtra 400070, India",Children's clothing store,+91 97027 75520,400070.0,0,Maharashtra,Kids World,
423,"Shop No 2, Plot No 555, 33rd Rd, Khar, Khar West, Mumbai, Maharashtra 400052, India",Children's clothing store,+91 98670 79796,400052.0,5,Maharashtra,Masti Kids Wear,
414,"Sanitorium Ln, Bhatwadi, Kapol wadi, Pant Nagar, Ghatkopar West, Mumbai, Maharashtra 400086, India",Children's clothing store,+91 98947 51201,400086.0,1,Maharashtra,Arihant Emporium,
415,"37, Hill Rd, opp. Elco Market, Santosh Nagar, Bandra West, Mumbai, Maharashtra 400050, India",Children's clothing store,+91 99670 22325,400050.0,22,Maharashtra,Dots,
417,"Shop No.3, Roshan House,plot Nbr 130 35th Road, Old Khar, Khar Rd, W, Mumbai, Maharashtra 400052, India",Children's clothing store,+91 97027 82045,400052.0,3,Maharashtra,Krishna Collection (Children wear),http://www.krishnacollection.com/
418,"Air india, 180, Kalina Kurla Rd, opposite union bank, Santacruz, Mumbai, Vidya Nagari, Kalina, e, Mumbai, Maharashtra 400098, India",Children's clothing store,+91 86919 07005,400098.0,1,Maharashtra,Deepak Stores,
568,"Room no. 04, Khalil Chawl, Mahatma Gandhi Rd, near S.T. Depot, Sukarwadi, Borivali East, Mumbai, Maharashtra 400066, India",Children's clothing store,+91 788 064 0226,400066.0,1,Maharashtra,Ashirwad Creation,https://www.ashirvadcreations.in/
495,"shop No. 6, New Highway Park, E-3, Kandivali, Gokul Heven, Thakur Complex, Kandivali East, Mumbai, Maharashtra 400101, India",Children's clothing store,+91 98190 91438,400101.0,2,Maharashtra,SMALL WONDER THAKUR COMPLEX,
494,"Shop no.46, new, Bhoomi Park Phase 2 Rd, Malad, Jankalyan Nagar, Malad West, Mumbai, Maharashtra 400095, India",Children's clothing store,+91 91678 89054,400095.0,15,Maharashtra,RITURAJ best kid's & new born shop,https://www.instagram.com/rituraj_apparels?igsh=bzF5M3BhZmxzZXEz
491,"Shop No.F-47/48, Moksh Plaza, SV Rd, near BORIVALI RAILWAY STATION, Mhatre Wadi, Borivali West, Mumbai, Maharashtra 400092, India",Children's clothing store,+91 79779 64134,400092.0,107,Maharashtra,Pogo Kids Wear,https://www.instagram.com/pogokidsborivali/
397,"Samhita Complex, 23, Anil Chambers Telephone Exchange, behind Saki Naka, Andheri East, Mumbai, Maharashtra 400072, India",Children's clothing store,+91 77188 54563,400072.0,0,Maharashtra,Little Clothings,http://www.littleclothings.com/
420,"B/1, Plot no 38, Road No.5, Govandi Slums, Govandi West, Adasa Nagar, Shivaji Nagar, Mumbai, Maharashtra 400043, India",Children's clothing store,+91 81089 78207,400043.0,1,Maharashtra,A.S.brothers,
394,"Shop No.6, Elchiwala Building, Mahatma Gandhi Rd, opp. Kapol Wadi, Ghatkopar West, Mumbai, Maharashtra 400086, India",Children's clothing store,+91 98702 69964,400086.0,32,Maharashtra,Saloni Kids Wear,
390,"Shop No.15, 1st Floor, East Point Mall, SG Barve Marg, Jagruti Nagar, Nehru Nagar, Kurla, Mumbai, Maharashtra 400024, India",Children's clothing store,+91 84510 61403,400024.0,41,Maharashtra,DAPP KIDS,
460,"17, C/1, Road No. 2, Govandi Slums, Govandi West, Phase 1, Shivaji Nagar, Mumbai, Maharashtra 400043, India",Children's clothing store,+91 83558 41928,400043.0,1,Maharashtra,Fatima Traders & Wholesaler,
461,"Shop no 2, Laxmi chayya building, Bhandup Station Rd, near top 10 mobile shop, Bhandup West, Mumbai, Maharashtra 400078, India",Children's clothing store,+91 97734 20641,400078.0,6,Maharashtra,Jack N Jill,
563,"Shop No:G-40, Moksh Plaza, SV Rd, Mhatre Wadi, Borivali West, Mumbai, Maharashtra 400092, India",Children's clothing store,+91 98339 98997,400092.0,0,Maharashtra,Half Ticket,
562,"GATE NO 5 SHOP, 1189, Abdul Hamid Marg, Malad, Old Collector Compound, Malvani, Malad West, Mumbai, Maharashtra 400095, India",Children's clothing store,+91 79774 70370,400095.0,0,Maharashtra,FUNKY'Z KIDS,
561,"Raghuleela Mega Mall, 104, Poisar, Kandivali West, Mumbai, Maharashtra 400067, India",Children's clothing store,+91 86521 31510,400067.0,0,Maharashtra,TERRY BERRY KID'S WEAR,
462,"Shop 38, Pipermentwala Estate, Lal Bahadur Shastri Marg, Dina Bama Estate, Bhandup West, Mumbai, Maharashtra 400078, India",Children's clothing store,+91 77383 81606,400078.0,99,Maharashtra,HanselNGretel.in,http://hanselngretel.in/
452,"Shop no, Bakhtawar Building, 4, Kalina Jama Masjid Ln, Kolivery Village, Kalina, Andheri West, Mumbai, Maharashtra 400029, India",Children's clothing store,,400029.0,19,Maharashtra,Alishba kids store,
450,"3V8H+G9J, Kurla W Sta Rd, Kurla West, Kurla, Mumbai, Maharashtra 400070, India",Children's clothing store,+91 91372 12421,400070.0,0,Maharashtra,Junior Party,
449,"Shop No.6, Myra Sadan, W, Sonapur Ln, opp. City Hospital, Kurla West, Kurla, Mumbai, Maharashtra 400070, India",Children's clothing store,+91 90822 11552,400070.0,0,Maharashtra,My Choice,
448,"Near Kapolwadi, Samavsaran Building, Mahatma Gandhi Rd, Ghatkopar West, Mumbai, Maharashtra 400086, India",Children's clothing store,+91 98195 54550,400086.0,3,Maharashtra,Rachana,http://rachanasansad.edu.in/
435,"Shop 2, Biradari Building, Mahatma Gandhi Rd, opposite बैंक ऑफ़ बरोडा, Bhatwadi, Kapol wadi, Ghatkopar West, Mumbai, Maharashtra 400086, India",Children's clothing store,+91 98211 65688,400086.0,9,Maharashtra,Chheda Readymade Store,
122,"193, CG Rd, Chembur Colony, Indira Nagar, Chembur - 74, Mumbai, Maharashtra 400074, India",Children's clothing store,+91 98678 81566,400074.0,18,Maharashtra,Cotton Stock Kid's Wear,http://www.instagram.com/cottonstockkidswear
444,"Gali no d3 plot, No 27, Govandi Slums, Govandi West, Phase 1, Shivaji Nagar, Mumbai, Maharashtra 400043, India",Children's clothing store,,400043.0,0,Maharashtra,S A KIDS FASHION,
541,"Mann Mandir Chs, New Saibaba Nagar, Hemu Colony, Sector I, Kandivali West, Mumbai, Maharashtra 400067, India",Children's clothing store,,400067.0,0,Maharashtra,J P Section,
438,"Santacruz Railway Station Rd, Near seasons showroom gate, Railway Colony, Santacruz (West), Mumbai, Maharashtra 400054, India",Children's clothing store,,400054.0,0,Maharashtra,Elegant Fashion,
474,"Lal Bahadur Shastri Marg, Amrut Nagar, Ghatkopar West, Mumbai, Maharashtra 400086, India",Children's clothing store,,400086.0,906,Maharashtra,Mia & Mio,
384,"Road No. 2, Govandi Slums, Govandi West, Phase 1, Shivaji Nagar, Mumbai, Maharashtra 400043, India",Children's clothing store,+91 82918 76331,400043.0,14,Maharashtra,Fashion World,https://www.instagram.com/fashion_world.l1?utm_source=qr&igsh=MXV5YXFmZ2J6MGMyNw==
436,"Arun bazer, Santacruz Railway Station Rd, Willingdon, Santacruz, Mumbai, Maharashtra 400054, India",Children's clothing store,,400054.0,0,Maharashtra,Kids clothes,
388,"Shop No 5, Vaidya Bungalow, Mahatma Gandhi Rd, near Oopposite Bankl Of India, Ghatkopar West, Mumbai, Maharashtra 400086, India",Children's clothing store,,400086.0,0,Maharashtra,Siddhi Kids Wear,
127,"Ground floor, UG 008, Parekh Road, Malad West, Mumbai, Maharashtra 400064, India",Children's clothing store,+91 98926 46167,400064.0,3,Maharashtra,Baby Mall,
419,"5B, 160, Mittal Industrial Estate Rd, Mittal Industrial Estate, Marol, Andheri East, Mumbai, Maharashtra 400059, India",Children's clothing store,,400059.0,90,Maharashtra,Kidipoo,http://www.kidipoo.com/
12,"gate 4, Gala no 17AB, Naupada Road, Lane, nr. Al Quba Tower, next to Naaz Hotel, Mumbai, Maharashtra 400070, India",Children's store,+91 99676 32355,400070.0,0,Maharashtra,PiK A BOO,http://pikabooindia.com/
485,"Lal Tiwari Rd, near faizane Raza masjid, Kandivali, Ganesh Nagar, Kandivali West, Mumbai, Maharashtra 400067, India",Children's store,+91 75060 25351,400067.0,0,Maharashtra,Vip kids clothing store | kandiwali |,
475,"shop no 4A, Sanghvi Square, Mahatma Gandhi Rd, opp. bank of baroda, near chadva crockery, Bhatwadi, Kapol wadi, Ghatkopar West, Mumbai, Maharashtra 400086, India",Children's store,+91 98334 65522,400086.0,28,Maharashtra,New hello tweety,
340,"Subhash Nagar, Mohili, Ghatkopar West, Mumbai, Maharashtra 400084, India",Children's store,+91 85911 90682,400084.0,2,Maharashtra,CutiePea Kids Store and More,http://www.cutiepea.in/
385,"Shop 1 2 3, Raigad Darshan, Station, below Metro Station D N Nagar, Sahayog Nagar, Bhudargarh Colony, Andheri West, Mumbai, Maharashtra 400053, India",Children's store,+91 99203 19191,400053.0,266,Maharashtra,Glory Shopee,
114,"Media Complex, St Paul, 24th Road, Bandra West, Mumbai, Maharashtra 400050, India",Children's store,+91 99872 91674,400050.0,39,Maharashtra,Pinklay Kids,https://www.pinklay.com/
112,"Shop No.03, Zaver Mahal, RB Mehta Marg, Pant Nagar, Ghatkopar East, Mumbai, Maharashtra 400077, India",Children's store,+91 98339 25575,400077.0,272,Maharashtra,Blue Tango Toys Gifts and Novelty Store,http://www.bluetango.in/
147,"Shop No 12, Ground Floor, Sanghvi Square, Mahatma Gandhi Rd, opp. Bank Of Baroda, Bhatwadi, Kapol wadi, Ghatkopar West, Mumbai, Maharashtra 400086, India",Children's store,+91 80802 11086,400086.0,252,Maharashtra,Kitty Kids Department Store,http://kittykids.catalog.to/
337,"Shop No 13, Benzer building, Lokhandwala Complex, Andheri West, Mumbai, Maharashtra 400053, India",Children's store,+91 93218 53455,400053.0,28,Maharashtra,SOFT TOT,
709,"Shop No.1, Building No.42, Anand Tower, opp. Delicious Hotel, Chembur West, Tilak Nagar, Chembur, Mumbai, Maharashtra 400089, India",Toy store,+91 98196 31390,400089.0,37,Maharashtra,Guru Krupa Novelty - Toy Store & Gift Store,https://instagram.com/gurukrupanx_
205,"Gate No 26, Chhatrapati Shivaji Maharaj International Airport Mumbai, Terminal 1 Departure, Near, Domestic Arpt Rd, Mumbai, Maharashtra 400099, India",Toy store,+91 81697 55064,400099.0,418,Maharashtra,Hamleys- The finest toy shop in the world,https://stores.hamleys.in/hamleys-the-finest-toy-shop-in-the-world-mumbai-t1c-d-airport-toy-shop-chatrapati-shivaji-demostic-airport-mumbai-299135/Home
204,"84, 670, Off, New Link Rd, Motilal Nagar III, Goregaon West, Mumbai, Maharashtra 400104, India",Toy store,+91 72082 04541,400104.0,62,Maharashtra,Anas Souq,https://www.anassouq.com/
97,"Shop No 7, Shree Vallabh, Mathuradas Road, next to param gold, opp. lijat papad Kandivali, Kandivali, Bhagat Colony, W, Mumbai, Maharashtra 400067, India",Toy store,+91 81049 95709,400067.0,233,Maharashtra,House of Toys,
284,"Level 3, Mumbai International Airport Domestic Departure, Mumbai Airport, near JW Marriot Hotel, Navpada, Vile Parle East, Vile Parle, Mumbai, Maharashtra 400072, India",Toy store,+91 93244 90256,400072.0,110,Maharashtra,Hamleys- The finest toy shop in the world,https://stores.hamleys.in/hamleys-the-finest-toy-shop-in-the-world-mumbai-international-airport-toy-shop-mumbai-airport-mumbai-299133/Home
116,"nursing home, G5, swastik Chambers, Pipe Line Rd, below Kurla, Kurla West, Mumbai, Maharashtra 400070, India",Toy store,+91 70478 74787,400070.0,63,Maharashtra,ZIZI TOYS,https://mybillbook.in/store/zizi_toys
96,"CHANDAWARKAR ROAD, Raichura Cir, opp. JOYALIKKAS JWELLERS, next to BATA SHOP, Mumbai, Maharashtra 400092, India",Toy store,+91 83698 64543,400092.0,17,Maharashtra,LITTLE WONDER NX,
376,"Shop No. 9, Embassy Building, Apna Ghar Society, Unit No. 6, near Food Inn Restaurant, Lokhandwala Complex, Andheri West, Mumbai, Maharashtra 400053, India",Toy store,+91 75068 98924,400053.0,0,Maharashtra,Harish Collection,
209,"Unit No TF302, Infiniti Mall, New Link Rd, Malad, Mindspace, Malad West, Mumbai, Maharashtra 400064, India",Toy store,+91 88798 84218,400064.0,3993,Maharashtra,Hamleys- The finest toy shop in the world,https://stores.hamleys.in/hamleys-the-finest-toy-shop-in-the-world-infiniti-malad-toy-shop-malad-west-mumbai-299153/Home
592,"Shop No1, Sanghvi Square, Mahatma Gandhi Rd, Ghatkopar, Kapol wadi, W, Mumbai, Maharashtra 400086, India",Toy store,+91 22 2510 1900,400086.0,0,Maharashtra,Twinkle Toys & Costmetic,
130,"Basant Garden, Chembur, Mumbai, Maharashtra 400071, India",Toy store,+91 81041 25204,400071.0,3,Maharashtra,Bobtail,http://www.bobtail.in/
596,"Bharat Sports Corner, Complex, Mahatma Gandhi Rd, Pant Nagar, Ghatkopar East, Mumbai, Maharashtra 400077, India",Toy store,+91 98212 80251,400077.0,303,Maharashtra,Bharat Toys,
110,"Shop no.3, Bldg, RB Mehta Marg, opp. Sweet County, Pant Nagar, Ghatkopar East, Mumbai, Maharashtra 400077, India",Toy store,+91 73041 85626,400077.0,125,Maharashtra,Blue Tango Infants & Toys Store,https://www.bluetango.in/
689,"SHOP NO.6 BLDG NO.38 GREEN APT. VAISHALI NAGAR, JOGESHWARI (W), MUMBAI-400 102 SHOP NO.6 BLDG NO.38 GREEN APT. VAISHALI NAGAR, JOGESHWARI (W), MUMBAI, Mumbai, Maharashtra 400102, India",Toy store,,400102.0,23,Maharashtra,ALFAAZ NOOR TOYS COLLECTION,
47,"1st Floor, PHOENIX MARKETCITY, Shop No F, 35B & 36, Lal Bahadur Shastri Marg, Kurla, Mumbai, Maharashtra 400070, India",Toy store,+91 70816 32328,400070.0,1933,Maharashtra,Hamleys- The finest toy shop in the world,https://stores.hamleys.in/hamleys-the-finest-toy-shop-in-the-world-toy-shop-kurla-mumbai-433026/Home
46,"2, Mahatma Gandhi Rd, opp. Datta Mandir, Motilal Nagar, Goregaon West, Mumbai, Maharashtra 400104, India",Toy store,+91 98703 88448,400104.0,658,Maharashtra,Bhavya Toys,
665,"Shop No. 9, Sargam CHS, Building No. 40, Oshiwara Mhada Complex, New Link Road Extension, near Link Plaza Commercial Complex, Oshiwara, Andheri West, Mumbai, Maharashtra 400102, India",Toy store,+91 70217 17200,400102.0,0,Maharashtra,Patel Toys & Stationers,
343,"Shop no 1A, Maneesha chs, Gandhi Nagar, Gavanpada, Mulund East, Mumbai, Maharashtra 400081, India",Toy store,+91 96193 25211,400081.0,2,Maharashtra,Mumbai toys & more,
488,"Super Shopping Complex, Shop No. 25, nadco, SV Rd, near Trupti Farsan, Andheri West, Mumbai, Maharashtra 400058, India",Toy store,+91 98677 35675,400058.0,69,Maharashtra,Big Town - toys and bag store,
62,"Shop No. 1, Plot No. 18, Swami Vivekananda Rd, near Khar Masjid, Khar, Old, Khar West, Mumbai, Maharashtra 400052, India",Toy store,+91 99878 63642,400052.0,54,Maharashtra,Little Thumbs - The Toy Store,https://www.instagram.com/littlethumbs.in?igsh=MWQ3aDZocXV4ZHgxMg==
218,"2nd floor, Oberoi Mall, No S/13, Western Express Hwy, Yashodham, Goregaon, Mumbai, Maharashtra 400063, India",Toy store,+91 88799 75172,400063.0,1609,Maharashtra,Hamleys- The finest toy shop in the world,https://stores.hamleys.in/hamleys-the-finest-toy-shop-in-the-world-oberoi-hamleys-toy-shop-goregoan-east-mumbai-299161/Home
219,"Kamla Spaces, Swami Vivekananda Rd, Santacruz, Mumbai, Hasmukh Nagar, W, Mumbai, Maharashtra 400054, India",Toy store,,400054.0,25,Maharashtra,Toys4all,http://toys4all.in/
272,"Green turtle malad west oposit infinite mall, 102b, New Link Rd, near D-Mart & Infinity Mall, Malad, Ekta Nagar, Malad(W, Mumbai, Maharashtra 400064, India",Toy store,+91 99300 47505,400064.0,65,Maharashtra,GREENTURTLE,https://www.greenturtle.store/
617,"No -01, 168/1339, Db More Marg, Kala Galli, Motilal Nagar I, Goregaon West, Mumbai, Maharashtra 400104, India",Toy store,+91 87796 57838,400104.0,21,Maharashtra,Laxmi Agency,
481,"1st Floor, Cots and Cuddles, 24, Swami Vivekananda Rd, above DTDC, opposite Dream Suzuki Showroom, Mumbai, Maharashtra 400058, India",Toy store,+91 70457 15842,400058.0,350,Maharashtra,Cots and Cuddles,https://www.cotsandcuddles.com/
276,"Level 2, Arrival of CSIA, Terminal 2, CSM International Airport, Mumbai, Maharashtra 400099, India",Toy store,+91 93244 89468,400099.0,600,Maharashtra,Hamleys- The finest toy shop in the world,https://stores.hamleys.in/hamleys-the-finest-toy-shop-in-the-world-mumbai-t2a-toy-shop-csm-international-airport-mumbai-299134/Home
210,"Shop No G -1 Plot No 14 Laxmi Niwas Jawahar Nagar S.V ROAD Goregaon, West, Goregaon West, Mumbai, Maharashtra 400104, India",Toy store,+91 98201 57491,400104.0,541,Maharashtra,Riddhi Toy,
278,"Shop T21C, 3rd Floor, R City Mall, Fire Brigade, Lal Bahadur Shastri Marg, near Vikroli, Amrut Nagar, Ghatkopar West, Mumbai, Maharashtra 400086, India",Toy store,+91 22 6901 0345,400086.0,2327,Maharashtra,Hamleys- The finest toy shop in the world,https://stores.hamleys.in/hamleys-the-finest-toy-shop-in-the-world-toy-shop-ghatkopar-west-mumbai-433028/Home
141,"Shop no. 6, shilalaya shopping center, near Natraj cinema chembur (E, Chembur West, Chembur Gaothan, Chembur, Mumbai, Maharashtra 400071, India",Toy store,+91 83559 84097,400071.0,47,Maharashtra,Ronak Toys Emporium,https://chat.whatsapp.com/J732AmJlpoEBNBdHPESRCG
602,"Shop No 4, Rushabh Apartment, Pandit Jawaharlal Nehru Rd, Gavani Pada, Sarvodaya Nagar, Mulund West, Mumbai, Maharashtra 400080, India",Toy store,+91 90829 52556,400080.0,18,Maharashtra,"Mahaveer Stationery, Toys,Games and Gifts Store",
280,"Sanmati Society, opp. Kanta apt, Sugam Society, Savitribai Phule Nagar, Pant Nagar, Ghatkopar East, Mumbai, Maharashtra 400075, India",Toy store,+91 83690 69568,400075.0,36,Maharashtra,Toy Phactory,http://www.toyphactory.com/
89,"Shop no.8, Shiv Shrushti, New Link Rd, opp. Nirman Diagnostic centre, Kandivali, Satya Nagar, Kandivali West, Mumbai, Maharashtra 400067, India",Toy store,+91 72728 84747,400067.0,914,Maharashtra,Maru Collection,http://marucollection.com/
373,"Shop No.1 Kandpile Sadan, Babanrao Kulkarni Rd, Mulund East, Mumbai, Maharashtra 400081, India",Toy store,+91 96719 99316,400081.0,0,Maharashtra,Shree Ambaji Toys,
