,address,categoryName,phone,postalCode,reviewsCount,state,title,website
421,"Silver Pearl Building, 204, 218, Waterfield Road, Bandra West, Mumbai, Maharashtra 400050, India",Baby store,+91 91674 40140,400050.0,4,Maharashtra,Malabar Baby India,https://allthingsbaby.com/collections/malabar-baby
335,"Sahajivan Nivas, 10/7, Tembipada, Kokan Nagar, Bhandup West, Mumbai, Maharashtra 400078, India",Baby store,+91 88508 82732,400078.0,0,Maharashtra,Sawant Flower Shop,
368,"Shop No, 5Vcg+Ch4 Jai Bhai Nagar, Konkan Division, Jai Bhim Nagar, Goregaon, Mumbai, Maharashtra 400065, India",Baby store,+91 86918 16009,400065.0,2,Maharashtra,S.P. Daiper Stores,
334,"Shop No. 1, Sapna Sangeet Society, Yogi Hills (Inside Road), Swapna Nagari, Nirmal Nagar, Mulund West, Mumbai, Maharashtra 400080, India",Baby store,+91 91674 03325,400080.0,0,Maharashtra,Vishamberlal Yadv,
451,"13, 3rd floor, Raju Mansion, CLUSTER_MUMBAI SUBURBAN_402, Off, Vallabhbaug Ln, Railway Police Colony, Ghatkopar East, Mumbai, Maharashtra 400075, India",Baby store,,400075.0,0,Maharashtra,TRAVELICIOUS BABY,
333,"A-2, S Pratap Singh Rd, Satyavijay Society, Gadhav Naka, Panchsheel Nagar, Bhandup West, Mumbai, Maharashtra 400078, India",Baby store,+91 95173 35908,400078.0,1,Maharashtra,Aarif Karne,
331,"16, Lal Bahadur Shastri Marg, Sai Nagar, C.G.S. Colony, Kanjurmarg East, Mumbai, Maharashtra 400042, India",Baby store,+91 85910 39899,400042.0,0,Maharashtra,Ravi Tonka Moolya,
0,"Mahavir Nagar, Kandivali West, Mumbai, Maharashtra 400067, India",Baby store,+91 97694 07640,400067.0,43,Maharashtra,Baby boutique,http://www.babyboutiqemumbai.com/
536,"2, Tulsi Tavar T P S, Rod, Hanuman Nagar, Daulat Nagar, Borivali, Mumbai, Maharashtra 400066, India",Baby store,+91 99196 69859,400066.0,0,Maharashtra,Raviprakash Fruit,
514,"6RHG+9V8, behind Old Mhb Police Station, Swagat Society, MHB Colony, Gorai 1, Borivali West, Mumbai, Maharashtra 400091, India",Baby store,,,0,,Sunita Baby Care,
671,"32, Mahda Colony, Nehru Nagar, Kurla, Mumbai, Maharashtra 400024, India",Baby store,+91 89283 48996,400024.0,0,Maharashtra,Sushil Store,
670,"N3 Plot N28, Govandi Baiganwadi, Road N3 Plot N28 Cblock, Road, Cblock, Mumbai, Maharashtra 400043, India",Baby store,+91 97026 65099,400043.0,0,Maharashtra,Iqrar Store,
669,"Shop No12 G, Block Room, No24, Road No. 11, Govandi Slums, Govandi West, Baiganwadi, Shivaji Nagar, Mumbai, Maharashtra 400043, India",Baby store,+91 84249 94937,400043.0,0,Maharashtra,Rohit Store,
668,"Deonar Village Rd, Deonar, Govandi East, Mumbai, Maharashtra 400088, India",Baby store,+91 93268 80510,400088.0,0,Maharashtra,Verendra Store,
667,"Shell Colony Rd, Shramjivi Nagar, Sai Baba Nagar, Kurla, Mumbai, Maharashtra 400071, India",Baby store,,,0,,Jagajiban Rabi Baishya,
666,"Shop No 1, Mhada Colony, Gautam Nagar, Shivaji Nagar, Mumbai, Maharashtra 400043, India",Baby store,+91 90791 37165,400043.0,0,Maharashtra,Jasmita Pandy,
664,"Plot No 8/K, 5, Road No. 2, near Umar Masjid, Govandi Slums, Govandi West, Phase 1, Shivaji Nagar, Mumbai, Maharashtra 400043, India",Baby store,+91 87677 56056,400043.0,0,Maharashtra,Mahira Daiper,
661,"Shop No 12, Shiv Shakti Nagar, Chembur, Mumbai, Maharashtra 400071, India",Baby store,+91 88285 31047,400071.0,0,Maharashtra,Farman Shop,
660,"Shop No, 1, VN Purav Marg, Panchsheel Nagar, Chunabhatti, Sion, Mumbai, Maharashtra 400022, India",Baby store,+91 99301 17705,400022.0,2,Maharashtra,Laxmi Electric,
658,"WING-A, MAHALAXMI APARTMENT, 13-c, Sainath Mandir Chowk, Chembur West, Tilak Nagar, Chembur, Mumbai, Maharashtra 400089, India",Baby store,+91 88284 93465,400089.0,0,Maharashtra,Lalkishor,
657,"10, Nehru Nagar, Kurla, Mumbai, Maharashtra 400024, India",Baby store,+91 92196 50594,400024.0,0,Maharashtra,Ajay Store,
656,"CG Rd, Indira Nagar, Chembur, Mumbai, Maharashtra 400071, India",Baby store,+91 98670 10041,400071.0,1,Maharashtra,Aarif Sop,
655,"Jagruti Nagar, Nehru Nagar, Kurla, Mumbai, Maharashtra 400024, India",Baby store,+91 91371 89230,400024.0,1,Maharashtra,Shaikh store,
654,"3W45+WRH, Khardev Nagar, Chembur 1, Chembur, Mumbai, Maharashtra 400071, India",Baby store,+91 80941 48458,400071.0,0,Maharashtra,Sarika,
652,"Shop No 3 Room No 56, Govandi Slums, Lotus Colony, Shivaji Nagar, Mumbai, Maharashtra 400043, India",Baby store,+91 91673 56832,400043.0,0,Maharashtra,Rahims Store,
651,"Shop No 48, Malik Liyaqat Hussain Marg, opp. St Joseph School, Ambedkar Nagar, Kurla West, Kurla, Mumbai, Maharashtra 400070, India",Baby store,+91 98195 00340,400070.0,0,Maharashtra,Pamper Collection,
649,"Plot No 13, Rd Number 9, near BMC School, Govandi Slums, Govandi West, Baiganwadi, Shivaji Nagar, Mumbai, Maharashtra 400043, India",Baby store,+91 62031 07724,,1,,Subham Singh Solanki,
648,"N4 Plot 34, K Block Road N4, Govandi, Plot 34, Road, K Block, Baiganwadi, Mumbai, Maharashtra 400043, India",Baby store,+91 93103 72242,400043.0,0,Maharashtra,Meraj Store,
647,"Plot No 13 Room No 798, Govandi Slums, Lotus Colony, Shivaji Nagar, Mumbai, Maharashtra 400043, India",Baby store,+91 98676 37788,400043.0,0,Maharashtra,Sadiq Store,
646,"3002, Jeejabai Bhosale Marg, N1, Gajanand Colony, RamannNagar, Shivaji Nagar, Mumbai, Maharashtra 400043, India",Baby store,+91 77000 55560,400043.0,0,Maharashtra,Mubeen Store,
645,"Vijay Nagar, Andheri East, Mumbai, Maharashtra 400069, India",Baby store,+91 86558 82830,400069.0,0,Maharashtra,Anil Yadav,
672,"Govandi Slums, Govandi West, Adasa Nagar, Govandi East, Mumbai, Maharashtra 400043, India",Baby store,+91 98679 05465,400043.0,0,Maharashtra,Nile Traders,
673,"Lig, MIG Colony, Kurla West, Kurla, Mumbai, Maharashtra 400070, India",Baby store,+91 98198 81252,400070.0,0,Maharashtra,Fancy Sweets,
674,"Plot No 11, Rd Number 9, near Baiganwadi, Shivaji Nagar Number 2, Govandi West, Baiganwadi, Govandi, Mumbai, Maharashtra 400043, India",Baby store,+91 77229 94678,400043.0,0,Maharashtra,Chhotu,
675,"Govandi Slums, Lotus Colony, Govandi East, Mumbai, Maharashtra 400043, India",Baby store,+91 96697 94961,400043.0,0,Maharashtra,Niharikaa Mehtaa,
708,"Rd Number 9, Govandi Slums, Govandi West, Adasa Nagar, GOVANDI, Mumbai, Maharashtra 400043, India",Baby store,+91 82393 93706,400043.0,0,Maharashtra,SANJAY KUMAR,
706,"Road No.5, Govandi Slums, Govandi West, Adasa Nagar, Govandi, Mumbai, Maharashtra 400043, India",Baby store,+91 90820 41091,400043.0,0,Maharashtra,MUKESH KUMAR,
705,"Denmar Shop No 1, Deonar, Chembur, Mumbai, Maharashtra 400043, India",Baby store,+91 96803 58872,400043.0,0,Maharashtra,Ankita,
704,"Rd Number 9, Govandi Slums, Govandi West, Adasa Nagar, GOVANDI, Mumbai, Maharashtra 400043, India",Baby store,+91 80037 41886,400043.0,0,Maharashtra,KIRTI,
703,"Road No. 11, near Chai Khalifa, Govandi Slums, Govandi West, Baiganwadi, Govandi, Mumbai, Maharashtra 400043, India",Baby store,+91 95126 55247,400043.0,0,Maharashtra,Sneha,
702,"Shop 2, Road No. 3, Govandi Slums, Govandi West, Phase 1, Shivaji Nagar, Mumbai, Maharashtra 400043, India",Baby store,+91 88568 11818,400043.0,0,Maharashtra,UMEESH SHEKURAO KARE,
701,"Nehru Ni 1, Nehru Nagar, Kurla, Mumbai, Maharashtra 400024, India",Baby store,+91 89057 59031,400024.0,0,Maharashtra,Madhavi,
699,"shop no 1, Mhada Colony, Natvar Parekh Compound, Govandi East, Mumbai, Maharashtra 400043, India",Baby store,+91 72406 67338,400043.0,0,Maharashtra,sanjana verma,
698,"No 4, Shop No4 G Block S Line Room Road, Plot No 29, Shivaji Nagar, Mumbai, Maharashtra 400043, India",Baby store,+91 97025 62324,400043.0,0,Maharashtra,Rukshad Israr Khan Store,
697,"Shop No 68, G Block S Line, Govandi Slums, Govandi West, Adasa Nagar, Govandi East, Mumbai, Maharashtra 400043, India",Baby store,+91 88892 41052,400043.0,0,Maharashtra,Kavya Sharma,
643,"3VFJ+C9V, SG Barve Marg, Ambedkar Nagar, Kurla West, Kurla, Mumbai, Maharashtra 400070, India",Baby store,,,0,,Maza Diaperwala,
695,"S.N, 3W3H RHR, Annabhau Sathe Nagar, Govandi East, Mumbai, Maharashtra 400043, India",Baby store,+91 96199 73712,400043.0,0,Maharashtra,PRAKASH NANABHAU PATOLE,
692,"opp. Labbaik Store, Kasaiwada, Takshashila Nagar, Qureshi Nagar, Kurla, Mumbai, Maharashtra 400070, India",Baby store,+91 95684 91525,400070.0,0,Maharashtra,Zaidi,
691,"Shop No 89 G Block Q Line Room 79 Road No 5, Main Mumbai, Baiganwadi, Mumbai, Maharashtra 400043, India",Baby store,+91 93261 32534,400043.0,0,Maharashtra,MOHDHAROONSIRAJUDDINANSARI,
685,"Shop No 1 Plot 14 Road No 9, 43, Govandi Slums, Mumbai, Maharashtra 400043, India",Baby store,+91 70397 90829,400043.0,0,Maharashtra,Rehan Shaikh,
683,"Kamalabai Nagar, Govandi West, Goavandi, Shivaji Nagar, Mumbai, Maharashtra 400043, India",Baby store,+91 84342 18475,400043.0,0,Maharashtra,Abhishek Kumar,
682,"Ibn Faisal, 8254 Prince Ahmad Ibn Abdulrahman, PL Lokhande Marg, Mumbai, Maharashtra 400043, India",Baby store,+91 80825 30597,400043.0,0,Maharashtra,Toufiq Shop,
681,"No 4 H Blok, Shop, Road 13, Govandi Rd, Baiganwadi, Mumbai, Maharashtra 400043, India",Baby store,+91 79772 57289,400043.0,0,Maharashtra,Shamsul store,
680,"Shop No 4, G Block S Line Room, 44, Road No. 11, Govandi Slums, Govandi West, Baiganwadi, Shivaji Nagar, Mumbai, Maharashtra 400043, India",Baby store,+91 97683 04438,400043.0,0,Maharashtra,MAYUR DADA GADE,
678,"1, Road No. 1, Govandi Slums, Govandi West, Adasa Nagar, Govandi, Mumbai, Maharashtra 400043, India",Baby store,+91 70391 42397,400043.0,0,Maharashtra,MADAN LAL,
677,"Nehru Nagar, Kurla, Mumbai, Maharashtra 400024, India",Baby store,+91 92437 32723,400024.0,0,Maharashtra,sarika Saxsena,
676,"1, ACC Nagar, Chembur, Mumbai, Maharashtra 400043, India",Baby store,+91 89624 53463,400043.0,0,Maharashtra,Mariam,
694,"Road No. 8, Govandi Slums, Govandi West, Baiganwadi, Shivaji Nagar, Mumbai, Maharashtra 400043, India",Baby store,+91 98335 94355,400043.0,1,Maharashtra,Pardeep Vegetables,
640,"Ambari tiniali 10, New D. N. Nagar, D.N.Nagar, Andheri West, Mumbai, Maharashtra 400053, India",Baby store,+91 80116 10479,400053.0,0,Maharashtra,Jamal Uddin,
639,"Shop No 1, Plot, Bawa Boutique, Rd Number 10, Govandi Slums, Govandi West, Baiganwadi, Govandi East, Mumbai, Maharashtra 400043, India",Baby store,+91 97027 62698,400043.0,0,Maharashtra,Fashion Club,
631,"Pream nagar irla vile parle west Mumbai 400045, Navpada, Prem Nagar, Vile Parle West, Mumbai, Maharashtra 400056, India",Baby store,+91 98674 29195,400056.0,0,Maharashtra,Santosg Prajapati,
551,"67, Sundar Nagar, Borivali, Mumbai, Maharashtra 400092, India",Baby store,+91 88505 39228,400092.0,2,Maharashtra,Yeshwant D Shah HUF,
550,"Shop no 2 Kranti Nagar, Akurli Rd, Gokul Nagar, Kandivali East, Mumbai, Maharashtra 400101, India",Baby store,+91 70459 84782,400101.0,0,Maharashtra,Pitale Soup Shop,
548,"Shop No, 1kandivali Kandivali, Food Corporation of India Warehouse, Borivali, Mumbai, Maharashtra 400066, India",Baby store,+91 83061 69309,400066.0,0,Maharashtra,Ragvi,
545,"Shop No 21, Sheetal Bar, Vaishali Nagar, Dahisar East, Mumbai, Maharashtra 400068, India",Baby store,+91 82867 83598,400068.0,0,Maharashtra,Shiv Kumar Gupta,
543,"37borivali, Borivali, Mumbai, Maharashtra 400066, India",Baby store,+91 92793 83827,400066.0,0,Maharashtra,Pawan Kumar Shop,
542,"1, Kandivali, Jethava Nagar, Kandivali West, Mumbai, Maharashtra 400067, India",Baby store,+91 86570 80161,400067.0,0,Maharashtra,Shyamsundar Rajbhar,
540,"Jagannath Yadav Chawl, Hanuman Nagar Rd, Akurli Rd, Kandivali, Akurli Nagar, Kandivali East, Mumbai, Maharashtra 400101, India",Baby store,+91 82862 41984,400101.0,0,Maharashtra,Tayeba Collection MOHAMMAD SARFARAJ ABDUL MAJID SAYED,
538,"Shop No 1, Kandivali Kandivali, Food Corporation of India Warehouse, Borivali, Mumbai, Maharashtra 400066, India",Baby store,+91 96020 15998,400066.0,0,Maharashtra,Dabhi Narendrakumar Girdharilal,
537,"Shop No.1, Dias Apartments, near Fish Market, I C Colony, Borivali West, Mumbai, Maharashtra 400103, India",Baby store,+91 98205 92234,400103.0,0,Maharashtra,Nic Nat Enterprises,
301,"Shitladevi Chawl, D.N.Nagar, Andheri West, Mumbai, Maharashtra 400053, India",Baby store,,,0,,MummaMinute,
552,"Rampur Raygarh, Kandivali, Shiv Sagar, Kandivali East, Azamgarh, Mumbai, Uttar Pradesh 276001, India",Baby store,,,0,,Sadhana Shop,
534,"Shop No 1, Kandivali Kandivali, Food Corporation of India Warehouse, Borivali, Mumbai, Maharashtra 400066, India",Baby store,+91 75749 64889,400066.0,0,Maharashtra,Deepika Patel,
531,"Poisar Gav, Ali Ibrahim Chawl, Poisar, Kandivali East, Mumbai, Maharashtra 400067, India",Baby store,+91 98349 42418,400067.0,0,Maharashtra,Lalchand Store,
529,"Koli House, Malwani Church, 01, Marve Rd, Malad, Chikuwadi, Malad West, Mumbai, Maharashtra 400095, India",Baby store,,,0,,Agastya Kirana Store,
528,"31, Chikku Wadi Rd, Malad, Sai Krupa Nagar, Chikuwadi, Malad West, Mumbai, Maharashtra 400067, India",Baby store,+91 788 061 3691,400067.0,0,Maharashtra,Khuwaja Gareeb Nawaz,
527,"Shree ji Shopping Centre, Hospital, Mahatma Gandhi Rd, Kandivali, Bhagat Colony, Kandivali West, Mumbai, Maharashtra 400067, India",Baby store,+91 82912 31667,400067.0,0,Maharashtra,J K Medical And General Store,
525,"Kishori Khesari Flower, Kandivali, Charkop Gaon, Kandivali West, Mumbai, Maharashtra 400067, India",Baby store,+91 70625 10092,400067.0,0,Maharashtra,Kishori Pulavar,
523,"Sharma Chall, R R, Kata Road 3, Meghdoot, Mhatre Wadi, Borivali, Mumbai, Maharashtra 400092, India",Baby store,+91 88285 89880,400092.0,0,Maharashtra,P d hariya,
520,"Chaurasiya Fruit Corner, Bihari Tekdi, Poisar, Borivali West, Mumbai, Maharashtra 400101, India",Baby store,+91 91673 19930,400101.0,1,Maharashtra,Chaurasiya Food,
519,"Shop No, 02, Lal Tiwari Rd, Shop 2, Jagdish Shetty Rd, Kandivali, Ekta Nagar, Baji Mkt, Ganesh Nagar, Kandivali West, Mumbai, Maharashtra 400067, India",Baby store,+91 90657 87512,400067.0,0,Maharashtra,Jitendra Bag Shop,
517,"Poisar Market Rd, Station Road, Kandivali West, Mumbai, Maharashtra 400067, India",Baby store,+91 97693 29959,400067.0,0,Maharashtra,Dineshkumar Store,
516,"Shop Non1, Kandivali Kandivali, Kandivali, Janata Nagar, Kandivali East, Mumbai, Maharashtra 400101, India",Baby store,+91 92510 38381,400101.0,0,Maharashtra,Luxury,
532,"8, Jagdish Shetty Rd, Kandivali, Ekta Nagar, Kandivali West, Mumbai, Maharashtra 400067, India",Baby store,+91 85918 38687,400067.0,0,Maharashtra,Rajasthan Collection DINESHRJAIN,
511,"E19, Kandivali, Kranti Nagar, Kandivali East, Mumbai, Maharashtra 400101, India",Baby store,+91 97680 82363,400101.0,0,Maharashtra,Shingar Novelty,
553,"Shop No 1, Kandivali, Janata Nagar, Ghatkopar, Mumbai, Maharashtra 400101, India",Baby store,,,0,,Manoj Kumar,
558,"Tilak Nagar Lucknow Rd, Kandivali, Hanuman Nagar, Kandivali East, Azamgarh, Mumbai, Uttar Pradesh 276001, India",Baby store,+91 80155 40374,276001.0,0,Uttar Pradesh,Manish Shop,
629,"Block S Line Room, 28, Road No. 8, Govandi Slums, Govandi West, Baiganwadi, Shivaji Nagar, Mumbai, Maharashtra 400043, India",Baby store,+91 91379 47420,400043.0,0,Maharashtra,Soheb Shaikh,
624,"01, Cross Pakhadi Rd, Versova, Andheri West, Mumbai, Maharashtra 400061, India",Baby store,+91 90044 81526,400061.0,0,Maharashtra,Salman Kanda And Batata Shop,
623,"no 63, purandar building, Room no 317,B wing 3 rd floor, Mankhurd West, Mumbai, Maharashtra 400043, India",Baby store,,,2,,Dakshta palna Ghar,
616,"400061 Complex, 2/4, JP Rd, Veraoa Road, Achal Avichal Chanchal, Versova, Andheri West, Andheri, Mumbai, Maharashtra 400061, India",Baby store,+91 93261 15206,400061.0,0,Maharashtra,Aman Kumar Shop,
614,"Shop 1, Motilal Nagar I, Goregaon West, Vasai-Virar, Mumbai, Maharashtra 400104, India",Baby store,+91 89838 78315,400104.0,0,Maharashtra,Shiv Shakti Water Supplier,
610,"Dhanuka rebuild 405, Manmandir Co.operative Housing Society, D.N.Nagar, Andheri West, Mumbai, Maharashtra 400053, India",Baby store,,,0,,Asquare,
609,"4RXQ+4M8, Gulshan Nagar, Oshiwara, Jogeshwari West, Mumbai, Maharashtra 400102, India",Baby store,,,0,,Gulshan nagar Jogeshwari,
608,"City Max 401, Relief Road, Oshiwara, Jogeshwari West, Mumbai, Maharashtra 400102, India",Baby store,,,0,,Tourist And Travels,
607,"4V5C+VF5, Near sai baba mandir, Marol Pipeline Rd, opp. Mukund Hospital, Mumbai, Maharashtra 400059, India",Baby store,,,0,,Royal collection,
600,"Prem nagar near jansakti police choki oppsite smita bar mumbai, Jogeshwari East, Maharashtra 400060, India",Baby store,,,3,,Burhani A to Z daipers,
555,"187, Abhinav Nagar Rd 5, Abhinav Nagar, Borivali East, Mumbai, Maharashtra 400066, India",Baby store,,,0,,Manoj Kumar,
587,"B-803, SHREE NAMAN TOWERS, SV Rd, Kandivali, Bhadran Nagar, Kandivali West, Mumbai, Maharashtra 400067, India",Baby store,+91 98191 23139,400067.0,51,Maharashtra,Johnson Hosiery Works,http://thelovebaby.co.in/
583,"Shop No.14, Serene Shelter, next to Saraswat Bank, opp. Aryan Hospital, Nehru Nagar, Kurla, Mumbai, Maharashtra 400024, India",Baby store,+91 76667 86243,400024.0,43,Maharashtra,Diaper Point,
579,"ok, Kandivali, Singh Agri Estate, Kandivali East, Mumbai, Maharashtra 400101, India",Baby store,,,0,,Baby n Beyond,
576,"426, 427, Swami Vivekananda Rd, next to Jyoti Plaza, opposite Anandvan Ashram, Kandivali, A/1-A, Roopkamal Society, Kandivali West, Mumbai, Maharashtra 400067, India",Baby store,+91 99702 92784,400067.0,0,Maharashtra,BIGGIE BABY,
575,"2, Kandivali, Mumbai, Maharashtra 400101, India",Baby store,+91 91168 89967,400101.0,0,Maharashtra,Ramesh Patel,
571,"B-237, OIC, New Link Rd, Goregaon West, Mumbai, Maharashtra 400104, India",Baby store,+91 98205 05363,400104.0,0,Maharashtra,LITTLE DREAMZ,
569,"1/3, opp. Amrut hotel, nr. New Link Road, Kandivali, Kandivalis Dharavi, Maharashtra Nagar, Kandival, Mumbai, Maharashtra 400067, India",Baby store,+91 70216 15775,400067.0,0,Maharashtra,Samar Enterprises,
567,"Kandivali, MHADA Colony, Lokhandwala Twp, Kandivali East, Mumbai, Maharashtra 400101, India",Baby store,,,0,,Sprog Food,
566,"SHIV KRUPA CHS, 4, RDP 8, Sector 8, Kandivali West, Mumbai, Maharashtra 400092, India",Baby store,+91 80809 94413,400092.0,1,Maharashtra,Food House,
564,"LITLLE HUB NX , 322/43 SWAPNAPURTI C.H.S. LTD. , CHARKOP MARKET, SECTOR NUMBER 3, RSC Rd Number 32, Kandivali West, Mumbai, Maharashtra 400067, India",Baby store,,400067.0,0,Maharashtra,LITTLE HUB NX,
560,"7V48+764, Anannd Nagar Dahisar, Malad East, Mumbai, Maharashtra 400068, India",Baby store,+91 91374 05663,400068.0,0,Maharashtra,Suryoday Stores,
586,"sangeeta building, babuline naka, 16 new, dadiseth road, Kandivali, Irani Wadi, Malad West, Mumbai, Maharashtra 400067, India",Baby store,,400067.0,1,Maharashtra,Suman babysitting,
299,"Remi Commercio, 1006, Off Link Rd, Industrial Area, Andheri West, Mumbai, Maharashtra 400053, India",Baby store,,,0,,Gugu Cart Baby Products & Parenting Portal,https://gugucart.com/
328,"Sachin Housing Colony, Patil Nagar, Nane Pada, Mulund East, Mumbai, Maharashtra 400081, India",Baby store,+91 93269 05242,400081.0,0,Maharashtra,DINESH,
297,"Kingston Height, C-406, Chincholi Bunder Rd, Malad, Chincholi Bunder, Malad West, Mumbai, Maharashtra 400064, India",Baby store,,400064.0,0,Maharashtra,Babyluxurio,
154,"Shop No 5, Bilding DR2, Ram Mandir Rd, Mahatma Jyotiba Phule Nagar, Goregaon, Mumbai, Maharashtra 400104, India",Baby store,+91 98670 23230,400104.0,0,Maharashtra,M.R.pearfum,
153,"7, BMC Colony, Jai Bhim Nagar, Dindoshi, Goregaon, Mumbai, Maharashtra 400065, India",Baby store,+91 97837 93407,400065.0,0,Maharashtra,Sunil,
151,"211, LOTUS BUSINESS PARK, Ram Baug Road, SV Rd, near Chincholi Naka, Malad West, Mumbai, Maharashtra 400064, India",Baby store,+91 87796 57853,400064.0,30,Maharashtra,Terra (Terragentle) - Premium Baby Wipes and Baby Products in India,https://www.terragentle.in/
148,"Shop No.2, Swami Vivekananda Rd, near McDonalds, CHSL, Jawahar Nagar, Goregaon West, Mumbai, Maharashtra 400104, India",Baby store,+91 93242 12981,400104.0,13,Maharashtra,Angels Island,
146,"Shop no 5, Kanjurmarg Station Rd, MMRDA Colony, Ambedkar Nagar, Kanjurmarg West, Bhandup West, Mumbai, Maharashtra 400078, India",Baby store,+91 77382 42536,400078.0,0,Maharashtra,Kanjur Diaper House,
145,"Shop no 1, God Colony, Besides, Nehru Nagar, SBI bank, Kanjurmarg East, Mumbai, Maharashtra 400042, India",Baby store,+91 90043 07595,400042.0,78,Maharashtra,Baby On Board,https://babyonboardtoys.com/
143,"h line/house, Rd Number 9, near Sunni Jana Masjid, Govandi Slums, Govandi West, Phase II, Shivaji Nagar, Mumbai, Maharashtra 400043, India",Baby store,+91 98333 90559,400043.0,1,Maharashtra,D.C BABY CARE,
142,"Part 2, Bab E, Rehmat Masjid, Govandi Rafi Nagar Part 2 Bab E Rehmat Masjid, Mumbai, Maharashtra 400043, India",Baby store,+91 87796 92355,400043.0,0,Maharashtra,Yahiya Store,
140,"L,2, Plot no 44, Road No. 3, Govandi(W), Govandi West, Raman Mama Nagar, Shivaji Nagar, Mumbai, Maharashtra 400043, India",Baby store,,,1,,Baby Dry,
139,"Room No 32, H Block, Sai Baba Masjid, Shop No 12, Rafiq Nagar, Govandi East, Mumbai, Maharashtra 400043, India",Baby store,+91 93244 29069,400043.0,0,Maharashtra,Lal Babu Store,
137,"Shop N0 12, Bismillah Masjid, Plot N0 29, C Line, Rafiq Nagar, Shivaji Nagar, Mumbai, Maharashtra 400043, India",Baby store,+91 77108 63984,,0,,Asif Store,
155,"C-73, Pandit Jawaharlal Nehru Rd, near Make me smile, near Ma, Ramgad Nagar, Vishwakarma Nagar, Mulund West, Mumbai, Maharashtra 400080, India",Baby store,+91 92243 87596,400080.0,2,Maharashtra,Bharat Gupta,
135,"Plot No 32, near Tayyeba Masjid, Govandi Slums, Govandi West, Baiganwadi, Govandi East, Mumbai, Maharashtra 400043, India",Baby store,+91 98215 03981,400043.0,0,Maharashtra,Pari Diaper House,
132,"Govandi Slums, Gajanand Colony, Lotus Colony, Govandi East, Mumbai, Maharashtra 400043, India",Baby store,+91 63592 42706,400043.0,0,Maharashtra,Ananya,
128,"340, 1st Hasnabad Ln, Willingdon, Santacruz (West), Mumbai, Maharashtra 400054, India",Baby store,+91 98198 93280,400054.0,13,Maharashtra,Value Store,
125,"Plot N40, Road No. 6, Govandi Slums, Rafiq Nagar, Shivaji Nagar, Mumbai, Maharashtra 400043, India",Baby store,+91 80700 40821,400043.0,0,Maharashtra,Store,
124,"MEHBOOB E SUBHANI MASJID, 250 BHALEKAR WADI, New Mill Rd, beside MADINA HOTEL, Kurla West, Mumbai, Maharashtra 400070, India",Baby store,+91 78604 04303,400070.0,454,Maharashtra,Kohinoor Enterprises diaper disposable,
123,"Office No. 503, Signature Business Park, Postal Colony, Chembur, Mumbai, Maharashtra 400071, India",Baby store,+91 91676 84171,400071.0,9,Maharashtra,Coos N Babbles,https://www.coosnbabbles.com/
118,"opp. City Plaza, next to Dinar Building, Bajaj Wadi, Railway Colony, Santacruz (West), Mumbai, Maharashtra 400054, India",Baby store,+91 99679 58204,400054.0,3,Maharashtra,54 Kids Street,
117,"Shop no 41, Dwarka Building, no3, Station Road, near Nityanand hotel, MHADA Colony, Pant Nagar, Ghatkopar East, Mumbai, Maharashtra 400077, India",Baby store,,,6,,AAI Agency wholesale diaper.,
115,"Shop Number 3, Nari Seva Sadan Rd, Asalpha village, Ghatkopar West, Mumbai, Maharashtra 400084, India",Baby store,+91 99876 41437,400084.0,2,Maharashtra,Aadi Baby Care,
113,"Santacruz Railway Station Rd, near DINAR BUILDING, opposite Keravala Lodge, Navin Nagar, Willingdon, Santacruz (West), Mumbai, Maharashtra 400054, India",Baby store,+91 99679 58204,400054.0,5,Maharashtra,ALIZA DIAPERS,
108,"Sai Kiran Apartments, Central Aveneu Road, Dayanand Saraswati Rd, Mahadeo Wadi, Chembur, Mumbai, Maharashtra 400071, India",Baby store,+91 86527 67395,400071.0,18,Maharashtra,Tiny Tots,
107,"Flat no 302, Shree Saraswati CHS, Bldg B-1, Subhash Nagar, Chembur, Mumbai, Maharashtra 400071, India",Baby store,+91 90828 14408,400071.0,99,Maharashtra,Little And Wise,http://www.littleandwise.in/
134,"Shop N2, Vidy Bar, Sai Baba Mandir, Plot N21, Rafiq Nagar Rd, Govandi Slums, Rafiq Nagar, Govandi East, Mumbai, Maharashtra 400043, India",Baby store,+91 99872 05226,400043.0,0,Maharashtra,Rubeena Store,
105,"Rd No. 1, near Ambedkar Garden, Chembur Gaothan, Chembur, Mumbai, Maharashtra 400071, India",Baby store,,400071.0,5,Maharashtra,Festoons (For New Borns to Toddlers),
156,"4th floor, Ijmima Complex, Shop no, 437/438, behind Infinity Mall, Malad West, Mumbai, Maharashtra 400064, India",Baby store,+91 88501 82834,400064.0,88,Maharashtra,Props Ka Pitara,https://www.propskapitara.com/
158,"Ram Mandir, R 12, Ram Mandir Rd, Mahatma Jyotiba Phule Nagar, Jogeshwari West, Mumbai, Maharashtra 400104, India",Baby store,+91 79000 03116,400104.0,0,Maharashtra,New Lakshmi Store,
201,"Shop No 2, Bilal Masjid, Andheri - Ghatkopar Link Rd, Nair Wadi, Saki Naka, Mumbai, Maharashtra 400072, India",Baby store,+91 81081 40257,400072.0,0,Maharashtra,Link Cycles Shop Md Israr Malik,
200,"Shop No 1, Andheri - Ghatkopar Link Rd, Pereira Wadi, Asalpha, Mumbai, Maharashtra 400072, India",Baby store,,,0,,Riya Reddy,
199,"shop no 1, Andheri - Ghatkopar Link Rd, TPS Colony, Ghatkopar West, Mumbai, Maharashtra 400086, India",Baby store,+91 73398 44697,400086.0,0,Maharashtra,payel mehta,
198,"Shop No, Ghatkopar, Mumbai, Maharashtra 400086, India",Baby store,+91 97840 44531,400086.0,0,Maharashtra,Madhavi Reddy,
196,"rahmat masjid, Baba Nagar Rd, Rafiq Nagar, Shivaji Nagar, babe, Mumbai, Maharashtra 400043, India",Baby store,+91 98209 66137,400043.0,0,Maharashtra,Mohd Nabil Rizwan Shaikh,
195,"Ikra Creation, Govandi Slums, Rafiq Nagar, Shivaji Nagar, Mumbai, Maharashtra 400043, India",Baby store,+91 83694 54806,400043.0,0,Maharashtra,Iqra Creation,
193,"Shop No2 G, Block Room, N28 Road N4, Govandi Slums, Baiganwadi, Shivaji Nagar, Mumbai, Maharashtra 400043, India",Baby store,+91 90821 96158,400043.0,0,Maharashtra,Mohammad Kamil Khan,
188,"Sho No. 2, opp. Satellite Glory, Andheri East, Mumbai, Maharashtra 400059, India",Baby store,+91 98198 47935,400059.0,0,Maharashtra,Ramesh Pan Shop,
181,"High St, Hiranandani Gardens, Powai, Mumbai, Maharashtra 400076, India",Baby store,,,0,,Rajendra Kirana Store,
