,address,categoryName,phone,postalCode,reviewsCount,state,title,website
179,"Govandi Slums, Govandi West, 1wu 2nd, Shivaji Nagar, Mumbai, Maharashtra 400043, India",Baby store,+91 98676 73931,400043.0,0,Maharashtra,MOH SUFIYAN,
178,"Kalina Kurla Rd, Kolivery Village, Shastri Nagar, Kalina, Kurla, Mumbai, Maharashtra 400029, India",Baby store,+91 98670 09860,400029.0,0,Maharashtra,Durjan Tea Shop,
157,"Shop No 5, Neelam, Bori Colony, Vijay Nagar Colony West, Marol, Andheri East, Mumbai, Maharashtra 400059, India",Baby store,+91 98679 57509,400059.0,1,Maharashtra,Arifa Fast Food,
177,"Andheri - Ghatkopar Link Rd, Azad Nagar, Asalpha, Mumbai, Maharashtra 400086, India",Baby store,,,0,,Mehboob Mashak Patel,
175,"Chimatpada, Marol Naka, Andheri East, Mumbai, Maharashtra 400059, India",Baby store,+91 95944 98244,400059.0,0,Maharashtra,Prakash Footwear,
174,"Shop No 1, Ghatkopar, Mumbai, Maharashtra 400086, India",Baby store,+91 73598 49154,400086.0,0,Maharashtra,Deepika Patel,
298,"Sahyog Sall, 4, New Link Rd, Anand Nagar, Jogeshwari West, Mumbai, Maharashtra 400102, India",Baby store,+91 95945 19005,400102.0,0,Maharashtra,Kambeshwar Novelty Store,
173,"25, Shop Kurla Raoad, Ambedkar Nagar, Kurla West, Kurla, Mumbai, Maharashtra 400070, India",Baby store,+91 89575 13710,400070.0,0,Maharashtra,Kuldeep General Shop,
172,"Shop No19 S Block Room No57 Road No 5 Plot No29, Govandi Slums, Baiganwadi, Mumbai, Maharashtra 400043, India",Baby store,+91 91367 49906,400043.0,0,Maharashtra,Ramzan Store,
169,"Sabale Nagar, Kurla, Mumbai, Maharashtra 400024, India",Baby store,+91 84519 94831,400024.0,0,Maharashtra,Shree Hari General Store,
168,"Govandi Slums, Rafiq Nagar, Shivaji Nagar, Mumbai, Maharashtra 400043, India",Baby store,+91 97027 01392,400043.0,0,Maharashtra,MUDSAR SHAIKH,
166,"Singh Compound, Shop No.8, Navpada Rd, near Nandu Wafer, opp. Ajit Glass Road, Behram Baug, Jogeshwari West, Mumbai, Maharashtra 400102, India",Baby store,+91 90825 32545,400102.0,0,Maharashtra,Md Wakil,
164,"Shop No15 Room No H Line Govandi Shivaji Nagar Road No 2 Plot No26, Shivaji Nagar, Mumbai, Maharashtra 400043, India",Baby store,+91 77386 37384,400043.0,0,Maharashtra,Shamshad Store,
163,"No 1, Renuka Mata Mandir, Shop No 122, Bhagat Singh II, Goregaon West, Mumbai, Maharashtra 400104, India",Baby store,+91 81080 67804,400104.0,0,Maharashtra,DG Imitation Shop,
161,"Shop No 4, Bmc Market, Near, Staion, SV Patel Nagar, Andheri West, Mumbai, Maharashtra 400053, India",Baby store,,,0,,Royal daipers,
176,"Roshan PAN Card Ration Shop, Ambedkar Marg, Vidyavihar, Mumbai, Maharashtra 400077, India",Baby store,,,0,,Roshan PAN Card Ration Shop,
104,"Kusum Bharti, No. 201 Gorai Jeevandhara CHS Limited, Dattapada Rd, opposite Tata Steel, Borivali East, Mumbai, Maharashtra 400066, India",Baby store,+91 93242 40347,400066.0,17,Maharashtra,ITSYYBOO,
103,"3V6X+6P4, 20a, Rd No. 1, near B.M.C Office, Chembur Gaothan, Chembur, Mumbai, Maharashtra 400071, India",Baby store,,400071.0,11,Maharashtra,Little Angels,
102,"Shop 9 Tavas Shopping Centre, opposite Railway Station, Kandivali West, Mumbai, Maharashtra 400067, India",Baby store,+91 90824 92728,400067.0,36,Maharashtra,Kandivali Diaper Point,
35,"115, Lake Rd, Bhandup, Sonapur, Bhandup West, W, Mumbai, Maharashtra 400078, India",Baby store,+91 22 2594 8641,400078.0,0,Maharashtra,Florite Baby Products,http://floritebaby.com/
32,"MY DIVINE Co-Operative Housing Society Limited CTS No.132/2, Shop No- GF- 01 & 02, Aziz Baug, Mahul, Marouli Village Rd, Chembur, Mumbai, Maharashtra 400074, India",Baby store,+91 86000 26447,400074.0,1540,Maharashtra,FirstCry.com Store Mumbai Chembur East,https://www.firstcry.com/
31,"Shop No 26, G Sector 1, 2 Line, Line Road, Cheeta Camp, Trombay, Mumbai, Maharashtra 400088, India",Baby store,+91 96199 25775,400088.0,1,Maharashtra,A-1 Diapers,
30,"Gokul Gagan Apartment, Factory Lane Road, opposite Ambaji Dham Temple, Mini Zaveri Bazaar, Shimpoli, Borivali, Mumbai, Maharashtra 400092, India",Baby store,+91 96070 09506,400092.0,1823,Maharashtra,Babyhug Store Mumbai Borivali,
28,"Akshar Gully, B 701, Akshar Apt 2, Bldg, Hemukalani Cross Rd Number 3, behind Sai Raj Garden Apartment, Kandivali West, Mumbai, Maharashtra 400067, India",Baby store,+91 96196 80357,400067.0,92,Maharashtra,Strollers on Rent,https://strollers-on-rent.grexa.site/
26,"Maratha Colony Rd, Maratha Colony, Dahisar East, Mumbai, Maharashtra 400068, India",Baby store,+91 81696 21613,400068.0,49,Maharashtra,Dahisar Diaper House,
25,"Shop No.1, 2 & 3, Kamdar Shopping Arcade, Tilak Road, next to Food Spot, Ghatkopar East, Mumbai, Maharashtra 400077, India",Baby store,+91 90292 02030,400077.0,492,Maharashtra,Innocence Infants & Kids,https://www.facebook.com/innocence.shilp
23,"Shop no. 7, Matru Ashish CHSL, Chhatrapati Shivaji Rd, Krishna Colony, Dahisar East, Mumbai, Maharashtra 400068, India",Baby store,+91 96070 09022,400068.0,0,Maharashtra,Firstcry.com Factory Outlet Mumbai Dahisar,https://www.firstcry.com/?utm_source=gmb_optimization&utm_medium=organic&utm_campaign=gmb
22,"Sai Aastha CHS, No. 9 & 10, SV Rd, opp. Vasundhara, Mulji Nagar, Borivali West, Mumbai, Maharashtra 400092, India",Baby store,+91 74004 39190,400092.0,526,Maharashtra,Me n Moms Baby Care and Kids Store in Borivali West,https://www.menmoms.in/
20,"Shop No.1, Siddhachal Arcade, New Link Rd, Malad West, Mumbai, Maharashtra 400064, India",Baby store,+91 96070 08406,400064.0,649,Maharashtra,Babyhug Store Mumbai Malad,http://www.firstcry.com/
19,"Shop Number 93, Galleria Shopping Mall, Hiranandani Gardens, Panchkutir Ganesh Nagar, Powai, Mumbai, Maharashtra 400076, India",Baby store,+91 98200 61502,400076.0,0,Maharashtra,Little Baby,https://www.instagram.com/littlebabypowai
38,"PL Lokhande Marg, near hanuman mandir, Nagwadi, Rahul Nagar, Chembur, Mumbai, Maharashtra 400089, India",Baby store,+91 93236 04971,400089.0,29,Maharashtra,"Milee fashion:- Baby Carry Nest|Baby Mattress Set|Baby Pillow Supplier, Manufacturer in Mumbai, Maharashtra",
17,"1st Floor, PHOENIX MARKETCITY, No F 64, Lal Bahadur Shastri Marg, Patelwadi.Kurla, Kurla West, Kurla, Mumbai, Maharashtra 400070, India",Baby store,+91 80 4495 3389,400070.0,0,Maharashtra,"Me N Moms Phoenix Marketcity, Kurla, Mumbai",https://www.menmoms.in/
15,"Shop no7, Dosti Heritage D'Souza Nagar, 90 Feet Rd, kurla(W, Saki Naka, Mumbai, Maharashtra 400072, India",Baby store,+91 98200 77736,400072.0,6,Maharashtra,Baby care diaper enterprises,
11,"17 B/A-606, Ganga CHS, Sangharsh Nagar, Chandivali, Powai, Mumbai, Maharashtra 400072, India",Baby store,,,1,,Raj Enterprises,
10,"Shop no. 8, manek nagar, opp.Merwans cake shop Gulmohar Rd, Cross, Lokmanya Tilak Rd, Borivali West, Mumbai, Maharashtra 400092, India",Baby store,+91 91360 03603,400092.0,35,Maharashtra,Baby N Beauty,
9,"91, Galleria shopping, Main St, Hiranandani Gardens, Panchkutir Ganesh Nagar, Powai, Mumbai, Maharashtra 400076, India",Baby store,+91 99876 44736,400076.0,0,Maharashtra,Kaddly the little baby shop,https://www.facebook.com/kaddly/
8,"Kandivali, Laljipada, Ganesh Nagar, Kandivali West, Mumbai, Maharashtra 400067, India",Baby store,,400067.0,15,Maharashtra,Shourya Diaper Point,
7,"Shop No. 5, Munisuvrat Apartment, Mathuradas Road, Kandivali, Bhagat Colony, Kandivali West, Mumbai, Maharashtra 400067, India",Baby store,+91 91360 03602,400067.0,0,Maharashtra,New Baby N Beauty,
6,"Koyana Apartments, Sant Dnyaneshwar Rd, Shantivan, Sri Krishna Nagar, Borivali East, Mumbai, Maharashtra 400066, India",Baby store,,400066.0,0,Maharashtra,Beauty Mums & Babies,
5,"Shop No. 5, Kasturba, Cross Road No. 3, near Sai Dham Temple, Chinchpada, Borivali East, Mumbai, Maharashtra 400066, India",Baby store,+91 84519 56440,400066.0,423,Maharashtra,Asfiya Enterprises,
3,"Shop No 4, Ahimsa Marg, off New Link Road, Malad, Chincholi Bunder, Malad West, Mumbai, Maharashtra 400064, India",Baby store,+91 70459 22618,400064.0,48,Maharashtra,Sunera,
2,"Shop No 2, Bindiya Society, Ramdas Nayak Marg, Hill Rd, Bandra West, Mumbai, Maharashtra 400050, India",Baby store,+91 91671 66166,400050.0,45,Maharashtra,Baby Touch,
1,"metro station On, New Link Rd, Kandivali, Pragati Society, At, Kandivali West, Mumbai, Maharashtra 400067, India",Baby store,+91 93244 26042,400067.0,651,Maharashtra,Firstcry.com Store Mumbai Kandivali,http://www.firstcry.com/
16,"Gr Floor, C&B Square, Sangam Complex, 127, Andheri - Kurla Rd, Dr. Charatsingh Colony, S B Singh Colony, J B Nagar, Andheri (E, Mumbai, Maharashtra 400059, India",Baby store,+91 99875 49314,400059.0,23,Maharashtra,Tots & Bubbles,https://totsandbubbles.com/
40,"Akurli Rd, Kandivali, Akurli Industry Estate, Kandivali East, Mumbai, Maharashtra 400101, India",Baby store,,400101.0,0,Maharashtra,BABY EQUIPMENT STORE,
41,"211, LOTUS BUSINESS PARK, Ram Baug Road, SV Rd, near Chincholi Naka, Malad West, Mumbai, Maharashtra 400064, India",Baby store,+91 87796 57853,400064.0,37,Maharashtra,Kiddicare - Premium Baby Wipes in india,https://www.kiddicare.co.in/
42,"4Vcr+C8G Budhaya Jadhav Wadi, Saki Vihar Rd, Saki Vihar, Tunga Village, Marol, Powai, Mumbai, Maharashtra 400072, India",Baby store,+91 97689 01071,400072.0,5,Maharashtra,Zeeshan Super Diaperss,
98,"Shop No. 4, Royal House, Mathuradas Road, below Kapol Bank, Kandivali, Bhagat Colony, Kandivali West, Mumbai, Maharashtra 400067, India",Baby store,+91 98706 26343,400067.0,0,Maharashtra,Born Baby,
90,"B-105, Farid Estate Rd, Kandivali, Thakur Village, Kandivali East, Mumbai, Maharashtra 400101, India",Baby store,+91 74002 29966,400101.0,29,Maharashtra,Dumbledo,https://www.dumbledo.com/
86,"Sapphire Heights, Akurli Rd, Kandivali, Green Hills, Lokhandwala Twp, Kandivali East, Mumbai, Maharashtra 400101, India",Baby store,+91 89289 11801,400101.0,41,Maharashtra,KinderCanteen,
83,"Upper Ground Floor - 13, Sainath Plaza, Mulund Railway Station, Patil's, Pandit Jawaharlal Nehru Rd, nr. Mulund West, Mulund West, Mumbai, Maharashtra 400080, India",Baby store,+91 91372 73838,400080.0,79,Maharashtra,"Titapu, Baby & Kids Clothing Discount Store",
82,"Cooperative Housing Society, Housing Society LTD, Shop No 19, D - Wing, Shyam Kamal Road, opposite Sahakari Bhandar, Agarwal Market, Vile Parle East, Mumbai, Maharashtra 400057, India",Baby store,+91 93722 52224,400057.0,25,Maharashtra,Baby Safari,https://www.instagram.com/baby_safari__
79,"A, Agrawal Market, Shop no 3 Shyam Kamal, Tejpal Rd, opp. Dinanath Hall, Vile Parle East, Mumbai, Maharashtra 400057, India",Baby store,+91 91369 29928,400057.0,28,Maharashtra,BABIRO vile parle Mumbai,http://www.babiro.in/
77,"Shop No .18, Linkway Estate, New Link Rd, behind Hotel Green 's, next to Shakti Motors, Malad, Ram Nagar, Malad West, Mumbai, Maharashtra 400064, India",Baby store,+91 83558 06874,400064.0,83,Maharashtra,"Pink Bunny Baby Store, Malad",
76,"shop no.2, pioneer heritage resi-2, Sane Guruji Rd, next to sane guruji school, Khira Nagar, Santacruz (West), Mumbai, Maharashtra 400054, India",Baby store,+91 99308 64735,400054.0,41,Maharashtra,SUPER KIDS,
75,"L.G.8, Vaishali Arcade, Vaikunthlal Mehta Rd, next to Options Fashion Mall, Yamuna Nagar, Nehru Nagar, JVPD Scheme, Juhu, Mumbai, Maharashtra 400049, India",Baby store,+91 98195 63662,400049.0,489,Maharashtra,Green Bell,http://greenbellonline.com/
74,"KABRA AURUM, B1501, 2, opp. Venus Charitable Trust's Joggers Park, Unnat Nagar, Goregaon West, Mumbai, Maharashtra 400104, India",Baby store,+91 93200 08055,400104.0,704,Maharashtra,HOOPA Baby Store,http://www.hoopa.in/
73,"Samkeet Apartments, Sant, Sant Janabai Rd, off Hanuman Road, Navpada, Vile Parle East, Vile Parle, Mumbai, Maharashtra 400057, India",Baby store,+91 93244 91533,400057.0,38,Maharashtra,Kicks & Crawl,https://kicksandcrawl.com/
72,"Shop No. 12 & 13, Ground Floor, Kothari Mall, Swami Vivekananda Rd, Malad, Vijaykar Wadi Industrial, Vijaykar Wadi, Malad West, Mumbai, Maharashtra 400064, India",Baby store,+91 98331 45929,400064.0,32,Maharashtra,Toddlerz Heaven,
71,"No. 3, 2/16 , Unnath Nagar, Mahatma Gandhi Rd, opp. Nutan Oil, Goregaon West, Mumbai, Maharashtra 400104, India",Baby store,+91 88798 47276,400104.0,16,Maharashtra,Mini world Baby Store,
69,"Shop No. A/12, Natraj Market, SV Rd, Malad, Vijaykar Wadi Industrial, Vijaykar Wadi, Malad West, Mumbai, Maharashtra 400064, India",Baby store,,,35,,Mom's Baby,
67,"Natraj Market, Shop No. 22 A,(1) Durga Galli, SV Rd, Malad West, Mumbai, Maharashtra 400064, India",Baby store,+91 99879 98426,400064.0,17,Maharashtra,Kanchan Kids-Baby Care products & Kids Wear In Malad Mumbai,
65,"Shop no 18, Linkway Estate, CTS no 1093, New Link Rd, near Greens Restaurant & Bata, behind Glass House, Malad, Ram Nagar, Malad West, Mumbai, Maharashtra 400064, India",Baby store,+91 83558 06874,400064.0,1,Maharashtra,Snowhite Baby Products,
61,"108, Raheja Plaza, Off Veera Desai Rd, Industrial Area, Andheri West, Mumbai, Maharashtra 400053, India",Baby store,,400053.0,0,Maharashtra,Windmill baby,https://windmillbaby.com/
60,"Shop No.16, Road No. 19, Chembur Gaothan, Chembur, Mumbai, Maharashtra 400071, India",Baby store,+91 98678 44843,400071.0,28,Maharashtra,Festoons Nx - Little Details,
58,"SHOP NO. 4 & 5 RAMDAS NAYAK MARG ( HILL, ROAD, Bandra West, Mumbai, Maharashtra 400050, India",Baby store,+91 99203 51772,400050.0,34,Maharashtra,DESIGN TOUCH,
55,"Nav Palmyra, 101, 21st Rd, Bandra West, Mumbai, Maharashtra 400050, India",Baby store,+91 96199 95004,400050.0,0,Maharashtra,BabyLu,
54,"Shop No 02 /12 Jayi Home Buddha Vikar Society, No 01, Kurla E, Mumbai, Maharashtra 400071, India",Baby store,+91 99209 68921,400071.0,0,Maharashtra,Kgn Diaper Depot,
51,"Shop No 61, House, Hira Kumbhar Chawl, Sg Barve Marg West, Kurla W Sta Rd, near Model Talkies, Kurla West, Mumbai, Maharashtra 400024, India",Baby store,+91 99202 76846,400024.0,0,Maharashtra,Baby Care,
49,"3RJR+27W Noor baby diaper, Willingdon, santacruz (w, Mumbai, Maharashtra 400054, India",Baby store,,,0,,Santacruz west,
44,"Khan Abdul Majid Marg, Vinobha Bhave Nagar, Kurla West, Kurla, Mumbai, Maharashtra 400070, India",Baby store,+91 91175 10046,400070.0,0,Maharashtra,Miyan Store,
43,"R1, Ekta chawal, Chaitanya Nagar, Iit Market, Powai, Mumbai, Maharashtra 400076, India",Baby store,+91 88792 45806,400076.0,4,Maharashtra,Baby shine Creation,
202,"Plot N43, Road No. 3, Govandi Slums, Govandi West, Baiganwadi, Shivaji Nagar, Mumbai, Maharashtra 400043, India",Baby store,+91 90825 15345,400043.0,0,Maharashtra,Mohammad zaim,
203,"Aryan General Store, Ashok Nagar, Saki Naka, Mumbai, Maharashtra 400070, India",Baby store,+91 82912 25558,400070.0,2,Maharashtra,Sangeetadevi Bholanath Chaurasia,
712,"Road No. 6, near Me A Money, Kamalabai Nagar, Govandi Colony, Adasa Nagar, Shivaji Nagar, Mumbai, Maharashtra 400043, India",Baby store,+91 88905 19746,400043.0,0,Maharashtra,Pallavi Roy,
235,"Saibaba Nagar, Pant Nagar, Ghatkopar, Mumbai, Maharashtra 400077, India",Baby store,+91 6355 924 382,400077.0,0,Maharashtra,Priya Singh,
262,"Brahmanwadi, Kurla, Mumbai, Maharashtra 400070, India",Baby store,+91 79778 76858,400070.0,0,Maharashtra,Krishnat Store,
261,"Shop no 07, A k Road, Safed Pul, Saki Naka, Mumbai, Maharashtra 400072, India",Baby store,+91 93266 32902,400072.0,0,Maharashtra,Nandlal shop,
216,"Shop No 12, Tagore Nagar, Vikhroli East, Mumbai, Maharashtra 400083, India",Baby store,,,0,,Badri Thakur,
260,"Shop No35, G Line S Block Room, 39, Road No.5, Govandi Slums, Govandi West, Baiganwadi, Shivaji Nagar, Mumbai, Maharashtra 400043, India",Baby store,+91 88875 87835,400043.0,0,Maharashtra,Sharik Store,
232,"Plot No 13, Rd Number 9, near Bmc School, Govandi Slums, Nirankar Nagar, Govandi, Mumbai, Maharashtra 400043, India",Baby store,+91 70395 71290,400043.0,0,Maharashtra,YUVRAJ ANANDRAJ NAIDU,
258,"N3, H Line Room, Shop N3 Plot N23 Govandi, N44, Jeejabai Bhosale Marg, Govandi Slums, Shivaji Nagar, Mumbai, Maharashtra 400043, India",Baby store,+91 96960 03396,400043.0,0,Maharashtra,Rahim Store,
217,"Shop No. 11, form Road, near by Police Chowki, opp. 27No. Building, Sangharsh Nagar, Chandivali, Andheri East, Mumbai, Maharashtra 400072, India",Baby store,+91 82914 98264,400072.0,0,Maharashtra,hardik shubhechaya daiper house,
257,"Shop No 1, Jarimari, Mumbai, Maharashtra 400072, India",Baby store,+91 91676 63801,400072.0,0,Maharashtra,Abdul Kuddus Shop,
256,"Shop No Abc, Hill Pramukh Please, Veera Desai Rd, Amboli, Andheri West, Mumbai, Maharashtra 400053, India",Baby store,+91 98330 69321,400053.0,2,Maharashtra,AMBOLI HILL PRAMUKH PALACE SRA SAHAKARI GRIHA NIRMAN SANSTHA MARYADIT,
255,"shop no 7, Pipe Line Rd, Buddha Colony, Kurla West, Kurla, Mumbai, Maharashtra 400070, India",Baby store,+91 81084 43762,400070.0,0,Maharashtra,AAmrapali shop,
254,"Shop Number13 Old Vora House Opp Post Office G.P Road, Grampanchayat Rd, Goregaon West, Mumbai, Maharashtra 400104, India",Baby store,+91 77058 24559,400104.0,0,Maharashtra,Dharmendra Yadav,
251,"Nicholaswadi, Gundavali, Nicolas Wadi Rd, Jijamata Colony, Andheri East, Mumbai, Maharashtra 400069, India",Baby store,,,0,,Rajeev Chaurasiya,
250,"C/53 opp dargah Kailash puri road, Road No. 1, Malad, Chinchowali Colony, Starter Colony, Pandurang Wadi, Malad East, Mumbai, Maharashtra 400097, India",Baby store,+91 82689 17946,400097.0,0,Maharashtra,Mohd Gulfam,
247,"Shop no, shrinath sopping centre, 26, D.J.road, khoka market, Kamala Nagar, Vile Parle West, Mumbai, Maharashtra 400056, India",Baby store,+91 22 2615 3610,400056.0,1,Maharashtra,Sweet Baby,
220,"Shop No:25, Kamdhar Shopping Center, Monghibai Rd, Park Rd, Vile Parle (East), Mumbai, Maharashtra 400057, India",Baby store,+91 99307 21235,400057.0,0,Maharashtra,Scooby Baby,
246,"Shop no 1, Road No. 3, near vidyadeep vidhyalay, municipal colony, Vikhroli Park Site, Varsha Nagar, Vikhroli West, Mumbai, Maharashtra 400079, India",Baby store,+91 73033 15040,400079.0,2,Maharashtra,FAMOUS HEENA DIAPER HOUSE,
245,"Gala No 3, Jignesh Diamond House, Subhash Ln, Pethe Nagar, Primal Nagar,, Malad East, Mumbai, Maharashtra 400097, India",Baby store,+91 98190 37457,400097.0,3,Maharashtra,Dhrupti Creation,
234,"N3, Plot N45, East Road, Govandi Slums, Rafiq Nagar, A Line, Mumbai, Maharashtra 400043, India",Baby store,+91 88550 51433,400043.0,0,Maharashtra,Munna,
236,"No H Plot, Shop No 1 Line, 27, Road No. 3, Shivaji Nagar, Mumbai, Maharashtra 400043, India",Baby store,+91 86899 08242,400043.0,0,Maharashtra,Azizul Shaikh,
230,"Shop No 1, Andheri - Ghatkopar Link Rd, Bhatwadi, Kapol wadi, Ghatkopar West, Mumbai, Maharashtra 400086, India",Baby store,,,0,,Priya Rav,
241,"Sindhi Camp, Nehru Nagar, Kurla, Mumbai, Maharashtra 400024, India",Baby store,+91 91674 64880,400024.0,0,Maharashtra,Armik Store,
229,"Shop No 1, Andheri - Ghatkopar Link Rd, TPS Colony, Ghatkopar West, Mumbai, Maharashtra 400086, India",Baby store,+91 89558 14311,400086.0,0,Maharashtra,Kavita,
228,"Shop No 01, CGS Colony, Ghatkopar West, Mumbai, Maharashtra 400086, India",Baby store,+91 73839 39358,400086.0,0,Maharashtra,Seljio,
214,"3WW6+8C5 Gavdevi, Sainath Nagar, Indira Nagar, Ghatkopar West, Mumbai, Maharashtra 400086, India",Baby store,+91 99207 11716,,0,,Afsara Harcatting Saylun,
227,"Room No 68, H Block, Sai Baba Mandir, Shop No 6, Govandi Slums, Rafiq Nagar, Mumbai, Maharashtra 400043, India",Baby store,+91 90289 65664,400043.0,0,Maharashtra,Shaukat Store,
225,"Unnat Nagar, 19/160, Mahatma Gandhi Rd, near Jain Hospital, Motilal Nagar III, Goregaon West, Mumbai, Maharashtra 400104, India",Baby store,,400104.0,12,Maharashtra,Baby Shower Favor India,https://www.facebook.com/BabyStepsMumbai
224,"Aboli Signel, 115, Swami Vivekananda Rd, Amboli, Andheri West, Mumbai, Maharashtra 400058, India",Baby store,+91 73075 18127,400058.0,6,Maharashtra,SHARUKH KHAN,
242,"Room No 24, Babe Rahmat Msajid, S Bloc G Line, Shop N012, Rafiq Nagar, Govandi East, Mumbai, Maharashtra 400043, India",Baby store,+91 93368 46039,400043.0,0,Maharashtra,Mahafooj Store,
223,"Shop No 1gg, Andheri - Ghatkopar Link Rd, TPS Colony, Ghatkopar West, Mumbai, Maharashtra 400086, India",Baby store,+91 87583 57164,400086.0,0,Maharashtra,Anuj Kumar,
244,"Santacruz, Kolivery Village, Santacruz East, Mumbai, Maharashtra 400029, India",Baby store,+91 88797 49747,400029.0,0,Maharashtra,S.A Vegetable And Supplies,
222,"Shop 4 Jay, Chhatrapati Shivaji Maharaj Int'l Airport Rd, Santoshi Mata Nagar, Sahar Village, Andheri East, Mumbai, Maharashtra 400099, India",Baby store,+91 97022 55839,400099.0,0,Maharashtra,Rohit Pan Shop,
226,"N3 Plot N28 Road N3, Plot N28, Jeejabai Bhosale Marg, Govandi Slums, Govandi West, Phase 1, Govandi East, Mumbai, Maharashtra 400043, India",Baby store,+91 93216 78717,400043.0,0,Maharashtra,Shahid Store,
263,"Shop No 1, Shivaji Nagar, Mumbai, Maharashtra 400043, India",Baby store,+91 70414 73241,400043.0,0,Maharashtra,Ananya Singh,
259,"Shop No 24, Gopalji Devi Chowk, H D Road, Bhatwadi, Kapol wadi, Ghatkopar West, Mumbai, Maharashtra 400086, India",Baby store,+91 76669 96986,400086.0,0,Maharashtra,World Fashion,
287,"Shop No 1019 Chawl No 127, No 7, MHB Colony, Gaikwad Nagar, Malvani, Malad West, Mumbai, Maharashtra 400095, India",Baby store,+91 98700 23359,400095.0,0,Maharashtra,Mamma's Choice Enterprises,
279,"Shop N0 30, Babe Rahmta Masjid, Plot NO 64, Baba Nagar Rd, Rafiq Nagar, Shivaji Nagar, Mumbai, Maharashtra 400043, India",Baby store,+91 90101 87083,400043.0,0,Maharashtra,Sakina Store,
281,"Nobel Hygiene Pvt Ltd (c/o DSA Electro Control Pvt Ltd A20, Cross Rd, MIDC Central Rd, Mulgaon, Andheri East, Mumbai, Maharashtra 400093, India",Baby store,+91 1800 266 0640,400093.0,2,Maharashtra,Teddyy Baby Diaper,https://teddyydiaper.in/
283,"Shop No,63, Rafi Nagar2, near New Kanrastaan Rd, Shivaji Nagar, Naidu Colony, Pant Nagar, Malad East, Mumbai, Maharashtra 400075, India",Baby store,+91 85917 17660,400075.0,0,Maharashtra,TS Store,
285,"Shop no.1, N.M/14/85, Industrial Road, Amrut Nagar, Ghatkopar West, Mumbai, Maharashtra 400086, India",Baby store,+91 75064 64630,400086.0,6,Maharashtra,Bharat Diaper House,
264,"h line/house, Shop No36, 46, 90 Feet Rd, Govandi Slums, Baiganwadi, Mumbai, Maharashtra 400043, India",Baby store,+91 81694 46300,400043.0,0,Maharashtra,Nafees Store,
288,"Shop No.48, Malik Liyaqat Hussain Marg, opp. St. Joseph School, Ambedkar Nagar, Kurla West, Kurla, Mumbai, Maharashtra 400070, India",Baby store,+91 77386 48421,400070.0,3,Maharashtra,KHAN PAMPER COLLECTION,
277,"Shop No 8, Sonawane Chawal, Station Rd, Vikhroli East, Mumbai, Maharashtra 400083, India",Baby store,+91 79777 66214,400083.0,0,Maharashtra,Hungama Collection,
289,"Shop No 4 H, Block S Line Room, Plot No 39, Road No. 8, Govandi Slums, Govandi West, Baiganwadi, Shivaji Nagar, Mumbai, Maharashtra 400043, India",Baby store,+91 97026 40975,400043.0,1,Maharashtra,Sahezad Store,
291,"Sane Guruji Nagar, Motilal Nagar III, Goregaon West, Mumbai, Maharashtra 400104, India",Baby store,,,0,Maharashtra,Mothercare,
207,"h line/house, Shop No 17 Q, Road No.5, Govandi Slums, Baiganwadi, Mumbai, Maharashtra 400043, India",Baby store,+91 76330 60514,400043.0,0,Maharashtra,Jahid Husain Shaikh Store,
292,"Shop No. c3, W Andheri Market Rd, near SV Road, Fish Market Area, Navneeth Colony, Andheri West, Mumbai, Maharashtra 400058, India",Baby store,,,1,,Khan pamper collection,
293,"Plot No, 1 & 2 Floor, Kagalwala House, 175, CST Road, behind Metro house, Kalina, Santacruz East, Mumbai, Maharashtra 400098, India",Baby store,+91 90049 76661,400098.0,0,Maharashtra,PuppetBox,https://puppetbox.in/
295,"Shop No 05, Gulshan Nagar, Behram Baug, Jogeshwari West, Mumbai, Maharashtra 400102, India",Baby store,+91 98670 61394,400102.0,3,Maharashtra,KHAN COLLECTION,
296,"Shop No 1 Pream Nagar, Teen Dongari, New Link Rd, near Sai Baba Mandir, Goregaon West, Mumbai, Maharashtra 400104, India",Baby store,+91 82861 01516,400104.0,0,Maharashtra,Mammas Choice,
290,"Ashok Heights, 1, Andheri, Mumbai, Maharashtra 400069, India",Baby store,+91 90224 70560,400069.0,1,Maharashtra,Archi R Chaurasiya,
211,"Road No. 8, Govandi Slums, Nirankar Nagar, Govandi, Mumbai, Maharashtra 400043, India",Baby store,+91 97127 70613,400043.0,0,Maharashtra,KARAN GANESH SHINDE,
233,"3W99+4PX Search Kar Do, Govandi Slums, Baiganwadi, Govandi East, Mumbai, Maharashtra 400043, India",Baby store,,,0,,Tanya Reddy,
275,"Shop 2 Room 56, Govandi Slums, Lotus Colony, Shivaji Nagar, Mumbai, Maharashtra 400043, India",Baby store,+91 93247 78205,400043.0,0,Maharashtra,Misam Store,
265,"90, Wire Gali, LBS Nagar, Lokmanya Tilak Nagar, Saki Naka, Mumbai, Maharashtra 400072, India",Baby store,+91 83693 78293,400072.0,0,Maharashtra,The daiper shop,
212,"Room No 21, Block C Line, Shop No 84 H, Rafiq Nagar, Govandi East, Mumbai, Maharashtra 400043, India",Baby store,+91 96536 76443,400043.0,0,Maharashtra,Rukhsar Shaikh Store,
267,"Shop No33A/k Block H Gali, Plot No 33, Road No. 6, Govandi Slums, Baiganwadi, Mumbai, Maharashtra 400043, India",Baby store,+91 91671 16497,400043.0,0,Maharashtra,Amjad Store,
268,"Shop No 35, Jawahar Nagar, Goregaon West, Mumbai, Maharashtra 400104, India",Baby store,+91 73094 53027,400104.0,0,Maharashtra,Ravi Tiwari,
269,"Shop 67, Jawahar Nagar, Goregaon West, Mumbai, Maharashtra 400104, India",Baby store,+91 90826 43738,400104.0,0,Maharashtra,Deepa Fabric,
266,"Room No 795, Shop 4, Plot No 13, Govandi Slums, Lotus Colony, Shivaji Nagar, Mumbai, Maharashtra 400043, India",Baby store,+91 81040 02026,400043.0,0,Maharashtra,Vasi Store,
271,"B-24, V Vidyalaya Rd, Shri Nagar, Goregaon West, Mumbai, Maharashtra 400104, India",Baby store,+91 90045 85806,400104.0,0,Maharashtra,Bimlesh,
273,"Shop No.-1, Sejal Park, Colony No 3, Bhagat Singh II, Goregaon West, Mumbai, Maharashtra 400104, India",Baby store,+91 72087 53502,400104.0,0,Maharashtra,Metro Collection,
274,"sienna tower, Lodha Fiorenza, B - 2801, Western Urban Rd, next to hub mall, Aarey Milk Colony, Goregaon, Mumbai, Maharashtra 400065, India",Baby store,+91 97698 87715,400065.0,0,Maharashtra,BabyBoo,
