"address","categoryName","phone","postalCode","reviewsCount","state","title","website"
"Mahavir Nagar, Kandivali West, Mumbai, Maharashtra 400067, India","Baby store","+91 97694 07640","400067","43","Maharashtra","Baby boutique","http://www.babyboutiqemumbai.com/"
"metro station On, New Link Rd, Kandivali, Pragati Society, At, Kandivali West, Mumbai, Maharashtra 400067, India","Baby store","+91 93244 26042","400067","651","Maharashtra","Firstcry.com Store Mumbai Kandivali","http://www.firstcry.com/"
"Shop No 2, Bindiya Society, Ramdas Nayak Marg, Hill Rd, Bandra West, Mumbai, Maharashtra 400050, India","Baby store","+91 91671 66166","400050","45","Maharashtra","Baby Touch",
"Shop No 4, Ahimsa Marg, off New Link Road, Malad, Chincholi Bunder, Malad West, Mumbai, Maharashtra 400064, India","Baby store","+91 70459 22618","400064","48","Maharashtra","Sunera",
"Yogi Prabhat bldg, D/8, 91, Yogi Nagar, Borivali, Mumbai, Maharashtra 400091, India","Surgical supply store","+91 90821 95552","400091","68","Maharashtra","Khodiyar Enterprise",
"Shop No. 5, Kasturba, Cross Road No. 3, near Sai Dham Temple, Chinchpada, Borivali East, Mumbai, Maharashtra 400066, India","Baby store","+91 84519 56440","400066","423","Maharashtra","Asfiya Enterprises",
"Koyana Apartments, Sant Dnyaneshwar Rd, Shantivan, Sri Krishna Nagar, Borivali East, Mumbai, Maharashtra 400066, India","Baby store",,"400066","0","Maharashtra","Beauty Mums & Babies",
"Shop No. 5, Munisuvrat Apartment, Mathuradas Road, Kandivali, Bhagat Colony, Kandivali West, Mumbai, Maharashtra 400067, India","Baby store","+91 91360 03602","400067","0","Maharashtra","New Baby N Beauty",
"Kandivali, Laljipada, Ganesh Nagar, Kandivali West, Mumbai, Maharashtra 400067, India","Baby store",,"400067","15","Maharashtra","Shourya Diaper Point",
"91, Galleria shopping, Main St, Hiranandani Gardens, Panchkutir Ganesh Nagar, Powai, Mumbai, Maharashtra 400076, India","Baby store","+91 99876 44736","400076","0","Maharashtra","Kaddly the little baby shop","https://www.facebook.com/kaddly/"
"Shop no. 8, manek nagar, opp.Merwans cake shop Gulmohar Rd, Cross, Lokmanya Tilak Rd, Borivali West, Mumbai, Maharashtra 400092, India","Baby store","+91 91360 03603","400092","35","Maharashtra","Baby N Beauty",
"17 B/A-606, Ganga CHS, Sangharsh Nagar, Chandivali, Powai, Mumbai, Maharashtra 400072, India","Baby store",,,"1",,"Raj Enterprises",
"gate 4, Gala no 17AB, Naupada Road, Lane, nr. Al Quba Tower, next to Naaz Hotel, Mumbai, Maharashtra 400070, India","Children's store","+91 99676 32355","400070","0","Maharashtra","PiK A BOO","http://pikabooindia.com/"
"12, Sangeet Samrat Naushad Ali Rd, sherly village, Bandra West, Mumbai, Maharashtra 400050, India","Hygiene articles wholesaler","+91 88797 25134","400050","13","Maharashtra","Diaper King",
"Nand Dham Industrial Estate, Marol Maroshi Rd, Gamdevi, Marol, Andheri East, Mumbai, Maharashtra 400059, India","E-commerce service","+91 99451 00007","400059","167","Maharashtra","KidsCity.in","http://www.kidscity.in/"
"Shop no7, Dosti Heritage D'Souza Nagar, 90 Feet Rd, kurla(W, Saki Naka, Mumbai, Maharashtra 400072, India","Baby store","+91 98200 77736","400072","6","Maharashtra","Baby care diaper enterprises",
"Gr Floor, C&B Square, Sangam Complex, 127, Andheri - Kurla Rd, Dr. Charatsingh Colony, S B Singh Colony, J B Nagar, Andheri (E, Mumbai, Maharashtra 400059, India","Baby store","+91 99875 49314","400059","23","Maharashtra","Tots & Bubbles","https://totsandbubbles.com/"
"1st Floor, PHOENIX MARKETCITY, No F 64, Lal Bahadur Shastri Marg, Patelwadi.Kurla, Kurla West, Kurla, Mumbai, Maharashtra 400070, India","Baby store","+91 80 4495 3389","400070","0","Maharashtra","Me N Moms Phoenix Marketcity, Kurla, Mumbai","https://www.menmoms.in/"
"Shop Number 1, Next Bhagwan Collection, Bazar, Santacruz Railway Station Rd, Willingdon, Santacruz (West), Navi Mumbai, Mumbai, Maharashtra 400054, India","Clothing store","+91 79000 01471","400054","68","Maharashtra","Gunjan New Born Baby & kids Wear",
"Shop Number 93, Galleria Shopping Mall, Hiranandani Gardens, Panchkutir Ganesh Nagar, Powai, Mumbai, Maharashtra 400076, India","Baby store","+91 98200 61502","400076","0","Maharashtra","Little Baby","https://www.instagram.com/littlebabypowai"
"Shop No.1, Siddhachal Arcade, New Link Rd, Malad West, Mumbai, Maharashtra 400064, India","Baby store","+91 96070 08406","400064","649","Maharashtra","Babyhug Store Mumbai Malad","http://www.firstcry.com/"
"Bhageshri Niwas, 227/C, Ground Floor, 21st Road, Dan Pada, SB Patil Rd, Khar West, Maharashtra 400052, India","Hygiene articles wholesaler","+91 73046 46649","400052","0","Maharashtra","BonBon Products - Baby Diapers and Adult Diapers","https://bonbonindia.com/"
"Sai Aastha CHS, No. 9 & 10, SV Rd, opp. Vasundhara, Mulji Nagar, Borivali West, Mumbai, Maharashtra 400092, India","Baby store","+91 74004 39190","400092","526","Maharashtra","Me n Moms Baby Care and Kids Store in Borivali West","https://www.menmoms.in/"
"Shop no. 7, Matru Ashish CHSL, Chhatrapati Shivaji Rd, Krishna Colony, Dahisar East, Mumbai, Maharashtra 400068, India","Baby store","+91 96070 09022","400068","0","Maharashtra","Firstcry.com Factory Outlet Mumbai Dahisar","https://www.firstcry.com/?utm_source=gmb_optimization&utm_medium=organic&utm_campaign=gmb"
"Unit no sf 244 second floor Infiniti, Infiniti Malad, Malad, Mindspace, Malad West, Mumbai, Maharashtra 400064, India","Children's clothing store","+91 81699 79061","400064","36","Maharashtra","Adidas Kids Infinity Malad","https://www.adidas.co.in/kids"
"Shop No.1, 2 & 3, Kamdar Shopping Arcade, Tilak Road, next to Food Spot, Ghatkopar East, Mumbai, Maharashtra 400077, India","Baby store","+91 90292 02030","400077","492","Maharashtra","Innocence Infants & Kids","https://www.facebook.com/innocence.shilp"
"Maratha Colony Rd, Maratha Colony, Dahisar East, Mumbai, Maharashtra 400068, India","Baby store","+91 81696 21613","400068","49","Maharashtra","Dahisar Diaper House",
"43, Shimpoli Rd, Vivekanand Nagar, Borivali West, Mumbai, Maharashtra 400092, India","Baby clothing store",,"400092","2","Maharashtra","Baby Moo",
"Akshar Gully, B 701, Akshar Apt 2, Bldg, Hemukalani Cross Rd Number 3, behind Sai Raj Garden Apartment, Kandivali West, Mumbai, Maharashtra 400067, India","Baby store","+91 96196 80357","400067","92","Maharashtra","Strollers on Rent","https://strollers-on-rent.grexa.site/"
"Sarita Prabhat Industrial & Residential Complex, Sagar building, Gala Number 204, Western Urban Rd, near Toll Plaza, near CNG pump, Diamond Industrial Estate, Dahisar East, Mumbai, Maharashtra 400068, India","Baby clothing store","+91 93728 51546","400068","1087","Maharashtra","Knitroot India Pvt Ltd","https://www.knitroot.com/"
"Gokul Gagan Apartment, Factory Lane Road, opposite Ambaji Dham Temple, Mini Zaveri Bazaar, Shimpoli, Borivali, Mumbai, Maharashtra 400092, India","Baby store","+91 96070 09506","400092","1823","Maharashtra","Babyhug Store Mumbai Borivali",
"Shop No 26, G Sector 1, 2 Line, Line Road, Cheeta Camp, Trombay, Mumbai, Maharashtra 400088, India","Baby store","+91 96199 25775","400088","1","Maharashtra","A-1 Diapers",
"MY DIVINE Co-Operative Housing Society Limited CTS No.132/2, Shop No- GF- 01 & 02, Aziz Baug, Mahul, Marouli Village Rd, Chembur, Mumbai, Maharashtra 400074, India","Baby store","+91 86000 26447","400074","1540","Maharashtra","FirstCry.com Store Mumbai Chembur East","https://www.firstcry.com/"
"Surganga Chs Kandivali, 12, Charkop Gaon, Mumbai, Maharashtra 400067, India","Clothing store","+91 79774 91686","400067","138","Maharashtra","Baby Smile Kids",
"Shop No.1, Shivaji Chowk, Guru Gobind Singh Marg, Mulund Colony, Mulund West, Mumbai, Maharashtra 400082, India","Baby clothing store","+91 93720 51150","400082","10","Maharashtra","Nice Baby",
"115, Lake Rd, Bhandup, Sonapur, Bhandup West, W, Mumbai, Maharashtra 400078, India","Baby store","+91 22 2594 8641","400078","0","Maharashtra","Florite Baby Products","http://floritebaby.com/"
"First Floor, Central Ave Rd, opposite HDFC Bank, Chembur, Mumbai, Maharashtra 400071, India","Clothing store","+91 22 6845 3500","400071","166","Maharashtra","Fabindia, Chembur","https://www.fabindia.com/"
"Shop no 1, Silver pearl building 213, Lane, Waterfield Road, opp. Amarsons, Bandra West, Mumbai, Maharashtra 400050, India","Manufacturer","+91 98926 86101","400050","5","Maharashtra","Mohini Impex( Manufacturers of Newborn baby Garments and accessories)",
"PL Lokhande Marg, near hanuman mandir, Nagwadi, Rahul Nagar, Chembur, Mumbai, Maharashtra 400089, India","Baby store","+91 93236 04971","400089","29","Maharashtra","Milee fashion:- Baby Carry Nest|Baby Mattress Set|Baby Pillow Supplier, Manufacturer in Mumbai, Maharashtra",
"Shop Number 1, options fashion mall ,Vile Parle Shopping Centre Vaikunthal Mehta Road, Above Sahakari Bhandar, Vile Parle West, Juhu, Mumbai, Maharashtra 400049, India","Children's clothing store",,"400049","52","Maharashtra","BABY BELL",
"Akurli Rd, Kandivali, Akurli Industry Estate, Kandivali East, Mumbai, Maharashtra 400101, India","Baby store",,"400101","0","Maharashtra","BABY EQUIPMENT STORE",
"211, LOTUS BUSINESS PARK, Ram Baug Road, SV Rd, near Chincholi Naka, Malad West, Mumbai, Maharashtra 400064, India","Baby store","+91 87796 57853","400064","37","Maharashtra","Kiddicare - Premium Baby Wipes in india","https://www.kiddicare.co.in/"
"4Vcr+C8G Budhaya Jadhav Wadi, Saki Vihar Rd, Saki Vihar, Tunga Village, Marol, Powai, Mumbai, Maharashtra 400072, India","Baby store","+91 97689 01071","400072","5","Maharashtra","Zeeshan Super Diaperss",
"R1, Ekta chawal, Chaitanya Nagar, Iit Market, Powai, Mumbai, Maharashtra 400076, India","Baby store","+91 88792 45806","400076","4","Maharashtra","Baby shine Creation",
"Khan Abdul Majid Marg, Vinobha Bhave Nagar, Kurla West, Kurla, Mumbai, Maharashtra 400070, India","Baby store","+91 91175 10046","400070","0","Maharashtra","Miyan Store",
"PRAMILA KUTIR, 3/504, New Mill Rd, nr. Mansi Aprt, BMC Colony, Kurla West, Kurla, Mumbai, Maharashtra 400070, India","Children's clothing store","+91 98213 29868","400070","0","Maharashtra","Baba Baby",
"2, Mahatma Gandhi Rd, opp. Datta Mandir, Motilal Nagar, Goregaon West, Mumbai, Maharashtra 400104, India","Toy store","+91 98703 88448","400104","658","Maharashtra","Bhavya Toys",
"1st Floor, PHOENIX MARKETCITY, Shop No F, 35B & 36, Lal Bahadur Shastri Marg, Kurla, Mumbai, Maharashtra 400070, India","Toy store","+91 70816 32328","400070","1933","Maharashtra","Hamleys- The finest toy shop in the world","https://stores.hamleys.in/hamleys-the-finest-toy-shop-in-the-world-toy-shop-kurla-mumbai-433026/Home"
"Shop No.4, Lal Bahadur Shastri Marg, opp. Sheetal Cinema, Kurla West, Kurla, W, Mumbai, Maharashtra 400070, India","Baby clothing store","+91 98205 39946","400070","18","Maharashtra","Kids Zone",
"3RJR+27W Noor baby diaper, Willingdon, santacruz (w, Mumbai, Maharashtra 400054, India","Baby store",,,"0",,"Santacruz west",
"Bhatti Pada Rd, Battipada, Bhandup West, Mumbai, Maharashtra 400078, India","Children's clothing store","+91 97571 13515","400078","40","Maharashtra","Sundaram Readymade New Born And Kids Wear, Bhandup, Mumbai",
"Shop No 61, House, Hira Kumbhar Chawl, Sg Barve Marg West, Kurla W Sta Rd, near Model Talkies, Kurla West, Mumbai, Maharashtra 400024, India","Baby store","+91 99202 76846","400024","0","Maharashtra","Baby Care",
"Building No. 14, Vaishali CHS, Shop no12, opposite Shayadri Ground, Tilak Nagar, Kurla, Mumbai, Maharashtra 400089, India","Baby clothing store",,"400089","9","Maharashtra","Cuddles Babies & Kids wear",
"First Floor, Kannada Welfare Society, next to Sunil Restaurant & Bar, behind 90 Feet Road, Railway Police Colony, Ghatkopar East, Mumbai, Maharashtra 400075, India","Baby clothing store","+91 91377 97974","400075","22","Maharashtra","Little Hatchlings","https://www.littlehatchlings.in/"
"Shop No 02 /12 Jayi Home Buddha Vikar Society, No 01, Kurla E, Mumbai, Maharashtra 400071, India","Baby store","+91 99209 68921","400071","0","Maharashtra","Kgn Diaper Depot",
"Nav Palmyra, 101, 21st Rd, Bandra West, Mumbai, Maharashtra 400050, India","Baby store","+91 96199 95004","400050","0","Maharashtra","BabyLu",
"3R8M+R8C, Sita Mahal, Opposite Khar Telephone Exchange, Linking Road, khar West, Mumbai, Maharashtra 400052, India","Children's clothing store","+91 22 2605 7407","400052","45","Maharashtra","Choose-N-Cherry Kids Wear",
"1st Floor, Durian Estate, A/106, Mulund - Goregaon Link Rd, Hanuman Tekdi, Goregaon, Mumbai, Maharashtra 400063, India","Store","+91 81690 90990","400063","85","Maharashtra","Ekaas Life","https://ekaaslife.com/"
"SHOP NO. 4 & 5 RAMDAS NAYAK MARG ( HILL, ROAD, Bandra West, Mumbai, Maharashtra 400050, India","Baby store","+91 99203 51772","400050","34","Maharashtra","DESIGN TOUCH",
"Shop No - F, Kamani, PHOENIX MARKETCITY, 63, Lal Bahadur Shastri Marg, Patelwadi.Kurla, Kurla West, Kurla, Mumbai, Maharashtra 400070, India","Children's clothing store","+91 22 4971 1409","400070","87","Maharashtra","Mothercare","https://www.mothercare.in/"
"Shop No.16, Road No. 19, Chembur Gaothan, Chembur, Mumbai, Maharashtra 400071, India","Baby store","+91 98678 44843","400071","28","Maharashtra","Festoons Nx - Little Details",
"108, Raheja Plaza, Off Veera Desai Rd, Industrial Area, Andheri West, Mumbai, Maharashtra 400053, India","Baby store",,"400053","0","Maharashtra","Windmill baby","https://windmillbaby.com/"
"Shop No. 1, Plot No. 18, Swami Vivekananda Rd, near Khar Masjid, Khar, Old, Khar West, Mumbai, Maharashtra 400052, India","Toy store","+91 99878 63642","400052","54","Maharashtra","Little Thumbs - The Toy Store","https://www.instagram.com/littlethumbs.in?igsh=MWQ3aDZocXV4ZHgxMg=="
"Gr-2, Josephine villa Josephine apartments, 44, St Andrews Rd, Bandra West, Mumbai, Maharashtra 400050, India","E-commerce service","+91 85913 85067","400050","1","Maharashtra","Cubkins Products Pvt Ltd","http://www.cubkins.com/"
"Lokhandwala Complex, Andheri West, Mumbai, Maharashtra 400053, India","Baby clothing store","+91 96198 23360","400053","17","Maharashtra","Aby Baby",
"Shop no 18, Linkway Estate, CTS no 1093, New Link Rd, near Greens Restaurant & Bata, behind Glass House, Malad, Ram Nagar, Malad West, Mumbai, Maharashtra 400064, India","Baby store","+91 83558 06874","400064","1","Maharashtra","Snowhite Baby Products",
"Shop No 302, Infinity Mall, New Link Rd, next to Goregaon Sports Club, Malad, Mindspace, Malad West, Mumbai, Maharashtra 400064, India","Baby clothing store","+91 93244 94084","400064","202","Maharashtra","Mothercare","https://stores.mothercare.in/mothercare-infiniti-malad-baby-clothes-malad-west-mumbai-298157/Home?utm_source=locator&utm_medium=googleplaces"
"Natraj Market, Shop No. 22 A,(1) Durga Galli, SV Rd, Malad West, Mumbai, Maharashtra 400064, India","Baby store","+91 99879 98426","400064","17","Maharashtra","Kanchan Kids-Baby Care products & Kids Wear In Malad Mumbai",
"Unit No 17, 2nd Flr, Jio World Drive Mall, Bandra Kurla Complex Rd, near MAKER MAXITY, Bandra Kurla Complex, Bandra East, Mumbai, Maharashtra 400051, India","Baby clothing store","+91 85914 04166","400051","206","Maharashtra","Mothercare","https://stores.mothercare.in/mothercare-jio-world-drive-baby-clothes-bandra-east-mumbai-298156/Home?utm_source=locator&utm_medium=googleplaces"
"Shop No. A/12, Natraj Market, SV Rd, Malad, Vijaykar Wadi Industrial, Vijaykar Wadi, Malad West, Mumbai, Maharashtra 400064, India","Baby store",,,"35",,"Mom's Baby",
"Shop No. 1, Teresa Triumph CHS, opp. blue fox hotel, beside Sukhdayak Society, Bamanpuri, J.B. Nagar, J B Nagar, Andheri East, Mumbai, Maharashtra 400059, India","Baby clothing store","+91 72081 95597","400059","97","Maharashtra","MABEL BABY STORE",
"No. 3, 2/16 , Unnath Nagar, Mahatma Gandhi Rd, opp. Nutan Oil, Goregaon West, Mumbai, Maharashtra 400104, India","Baby store","+91 88798 47276","400104","16","Maharashtra","Mini world Baby Store",
"Shop No. 12 & 13, Ground Floor, Kothari Mall, Swami Vivekananda Rd, Malad, Vijaykar Wadi Industrial, Vijaykar Wadi, Malad West, Mumbai, Maharashtra 400064, India","Baby store","+91 98331 45929","400064","32","Maharashtra","Toddlerz Heaven",
"Samkeet Apartments, Sant, Sant Janabai Rd, off Hanuman Road, Navpada, Vile Parle East, Vile Parle, Mumbai, Maharashtra 400057, India","Baby store","+91 93244 91533","400057","38","Maharashtra","Kicks & Crawl","https://kicksandcrawl.com/"
"KABRA AURUM, B1501, 2, opp. Venus Charitable Trust's Joggers Park, Unnat Nagar, Goregaon West, Mumbai, Maharashtra 400104, India","Baby store","+91 93200 08055","400104","704","Maharashtra","HOOPA Baby Store","http://www.hoopa.in/"
"L.G.8, Vaishali Arcade, Vaikunthlal Mehta Rd, next to Options Fashion Mall, Yamuna Nagar, Nehru Nagar, JVPD Scheme, Juhu, Mumbai, Maharashtra 400049, India","Baby store","+91 98195 63662","400049","489","Maharashtra","Green Bell","http://greenbellonline.com/"
"shop no.2, pioneer heritage resi-2, Sane Guruji Rd, next to sane guruji school, Khira Nagar, Santacruz (West), Mumbai, Maharashtra 400054, India","Baby store","+91 99308 64735","400054","41","Maharashtra","SUPER KIDS",
"Shop No .18, Linkway Estate, New Link Rd, behind Hotel Green 's, next to Shakti Motors, Malad, Ram Nagar, Malad West, Mumbai, Maharashtra 400064, India","Baby store","+91 83558 06874","400064","83","Maharashtra","Pink Bunny Baby Store, Malad",
"Shop No 2, Marol Maroshi Rd, opp. Bhavani Nagar, Mahavir Nagar, Marol, Andheri East, Mumbai, Maharashtra 400059, India","Baby clothing store","+91 99673 50976","400059","59","Maharashtra","First Smile New Born Paradise",
"A, Agrawal Market, Shop no 3 Shyam Kamal, Tejpal Rd, opp. Dinanath Hall, Vile Parle East, Mumbai, Maharashtra 400057, India","Baby store","+91 91369 29928","400057","28","Maharashtra","BABIRO vile parle Mumbai","http://www.babiro.in/"
"Ground & First Floor, Rajyog Residency, Dr Rajendra Prasad Rd, Kadam Pada, Gavane Pada, Vardhman Nagar, Mulund West, Mumbai, Maharashtra 400080, India","Store","+91 96070 01730","400080","1341","Maharashtra","Babyhug Store Mumbai Mulund","http://www.firstcry.com/"
"shop no.1, vazvilla chs, I C Colony, Borivali West, Mumbai, Maharashtra 400103, India","Baby clothing store","+91 22 2893 5504","400103","0","Maharashtra","Baby's Choice",
"Cooperative Housing Society, Housing Society LTD, Shop No 19, D - Wing, Shyam Kamal Road, opposite Sahakari Bhandar, Agarwal Market, Vile Parle East, Mumbai, Maharashtra 400057, India","Baby store","+91 93722 52224","400057","25","Maharashtra","Baby Safari","https://www.instagram.com/baby_safari__"
"Upper Ground Floor - 13, Sainath Plaza, Mulund Railway Station, Patil's, Pandit Jawaharlal Nehru Rd, nr. Mulund West, Mulund West, Mumbai, Maharashtra 400080, India","Baby store","+91 91372 73838","400080","79","Maharashtra","Titapu, Baby & Kids Clothing Discount Store",
"Shop No.5, Supreme Madhukar Building, Shimpoli Rd, Kastur Park, Borivali West, Mumbai, Maharashtra 400092, India","Baby clothing store","+91 98197 14978","400092","15","Maharashtra","Valkan Fashion 4 Kids",
"2, Jagdish Shetty Rd, Kandivali, Ekta Nagar, Kandivali West, Mumbai, Maharashtra 400067, India","Baby clothing store","+91 88793 90081","400067","3","Maharashtra","New fashion point",
"Sapphire Heights, Akurli Rd, Kandivali, Green Hills, Lokhandwala Twp, Kandivali East, Mumbai, Maharashtra 400101, India","Baby store","+91 89289 11801","400101","41","Maharashtra","KinderCanteen",
"shop no 9, gemini bulilding, Marve Rd, near st judes school paly ground, Malad, Divya Park, Jankalyan Nagar, Malad West, Mumbai, Maharashtra 400097, India","Children's clothing store","+91 90049 06182","400097","25","Maharashtra","Lil fly kids and new born shop",
"Shantinath Shopping Centre, SV Rd, Malad, Navy Colony, Mamledarwadi, Malad West, Mumbai, Maharashtra 400064, India","Baby clothing store","+91 96191 82323","400064","20","Maharashtra","Tiny Trends","http://www.twothree.in/"
"Shop no.8, Shiv Shrushti, New Link Rd, opp. Nirman Diagnostic centre, Kandivali, Satya Nagar, Kandivali West, Mumbai, Maharashtra 400067, India","Toy store","+91 72728 84747","400067","914","Maharashtra","Maru Collection","http://marucollection.com/"
"B-105, Farid Estate Rd, Kandivali, Thakur Village, Kandivali East, Mumbai, Maharashtra 400101, India","Baby store","+91 74002 29966","400101","29","Maharashtra","Dumbledo","https://www.dumbledo.com/"
"Shop no. 15, Navrang wadi, Akurli Rd, Hanuman Nagar, Kandivali East, Mumbai, Maharashtra 400101, India","Baby clothing store",,"400101","4","Maharashtra","Om kids wear",
"Shop No.47 Ground Floor, Centrium Mall, opp. Mahada no.1, Kandivali, MHADA Colony, Lokhandwala Twp, Kandivali East, Mumbai, Maharashtra 400101, India","Baby clothing store","+91 74004 81757","400101","25","Maharashtra","The Jaksh Baby Kids Wear",
"Lalji Shopping Centre, 12-13, Swami Vivekananda Rd, Gyan Nagar, Borivali West, Mumbai, Maharashtra 400092, India","Children's clothing store","+91 22 2898 0883","400092","86","Maharashtra","Variety Kids",
"Shop no 2, A, 02, Thakur Rd, opp. Thakur cinema, Thakur, Thakur Village, Kandivali East, Mumbai, Maharashtra 400101, India","Baby clothing store","+91 99209 75154","400101","39","Maharashtra","Little Baby",
"Shukla Shopping Centre, Main Carter Rd, opposite 3rd carter road, Chinchpada, Borivali East, Mumbai, Maharashtra 400066, India","Children's clothing store","+91 98670 27450","400066","181","Maharashtra","The Little Rabbits","https://d-thelittlerabbits.dotpe.in/"
"CHANDAWARKAR ROAD, Raichura Cir, opp. JOYALIKKAS JWELLERS, next to BATA SHOP, Mumbai, Maharashtra 400092, India","Toy store","+91 83698 64543","400092","17","Maharashtra","LITTLE WONDER NX",
"Shop No 7, Shree Vallabh, Mathuradas Road, next to param gold, opp. lijat papad Kandivali, Kandivali, Bhagat Colony, W, Mumbai, Maharashtra 400067, India","Toy store","+91 81049 95709","400067","233","Maharashtra","House of Toys",
"Shop No. 4, Royal House, Mathuradas Road, below Kapol Bank, Kandivali, Bhagat Colony, Kandivali West, Mumbai, Maharashtra 400067, India","Baby store","+91 98706 26343","400067","0","Maharashtra","Born Baby",
"Shop Number 8, Dev Chhaya Building, Bharucha Rd, Maratha Colony, Dahisar East, Mumbai, Maharashtra 400068, India","Children's clothing store",,"400068","11","Maharashtra","Alpa Readymade Centre",
"Padam Kids, A-1102, Eksar Rd, behind Dr. Manish Batt, CKP Colony, Borivali West, Mumbai, Maharashtra 400091, India","Manufacturer","+91 80801 64616","400091","57","Maharashtra","Padam Kids","https://www.indiamart.com/padam-kids/"
"Shop No-19, 2A, HIGHWAY PARK, E-2, Asha Nagar Rd, Kandivali, Gokul Heven, Thakur Complex, Kandivali East, Mumbai, Maharashtra 400101, India","Baby clothing store","+91 98706 57070","400101","14","Maharashtra","Sakshi Baby",
"Shop 9 Tavas Shopping Centre, opposite Railway Station, Kandivali West, Mumbai, Maharashtra 400067, India","Baby store","+91 90824 92728","400067","36","Maharashtra","Kandivali Diaper Point",
"3V6X+6P4, 20a, Rd No. 1, near B.M.C Office, Chembur Gaothan, Chembur, Mumbai, Maharashtra 400071, India","Baby store",,"400071","11","Maharashtra","Little Angels",
"Kusum Bharti, No. 201 Gorai Jeevandhara CHS Limited, Dattapada Rd, opposite Tata Steel, Borivali East, Mumbai, Maharashtra 400066, India","Baby store","+91 93242 40347","400066","17","Maharashtra","ITSYYBOO",
"Rd No. 1, near Ambedkar Garden, Chembur Gaothan, Chembur, Mumbai, Maharashtra 400071, India","Baby store",,"400071","5","Maharashtra","Festoons (For New Borns to Toddlers)",
"Sitaram Niwas, 4, Rd No. 1, opposite BMC Office, Chembur Gaothan, Chembur, Mumbai, Maharashtra 400071, India","Clothing store","+91 85917 34477","400071","0","Maharashtra","Baby Kraft",
"Flat no 302, Shree Saraswati CHS, Bldg B-1, Subhash Nagar, Chembur, Mumbai, Maharashtra 400071, India","Baby store","+91 90828 14408","400071","99","Maharashtra","Little And Wise","http://www.littleandwise.in/"
"Sai Kiran Apartments, Central Aveneu Road, Dayanand Saraswati Rd, Mahadeo Wadi, Chembur, Mumbai, Maharashtra 400071, India","Baby store","+91 86527 67395","400071","18","Maharashtra","Tiny Tots",
"Shop No.6 Laxmi Market, N.G.Acharya Marg, Station Road, Chembur, Acharya Marg, Chembur Gaothan, Chembur East, Mumbai, Maharashtra 400071, India","Baby clothing store","+91 75060 15761","400071","1","Maharashtra","Sunder Stores",
"Shop no.3, Bldg, RB Mehta Marg, opp. Sweet County, Pant Nagar, Ghatkopar East, Mumbai, Maharashtra 400077, India","Toy store","+91 73041 85626","400077","125","Maharashtra","Blue Tango Infants & Toys Store","https://www.bluetango.in/"
"Shop No-12, Jalaram Nagar No-3, V B Lane, Ghatkopar(E), Mumbai, Maharashtra 400077, India","Baby clothing store","+91 98690 67969","400077","27","Maharashtra","Natkhat",
"Shop No.03, Zaver Mahal, RB Mehta Marg, Pant Nagar, Ghatkopar East, Mumbai, Maharashtra 400077, India","Children's store","+91 98339 25575","400077","272","Maharashtra","Blue Tango Toys Gifts and Novelty Store","http://www.bluetango.in/"
"Santacruz Railway Station Rd, near DINAR BUILDING, opposite Keravala Lodge, Navin Nagar, Willingdon, Santacruz (West), Mumbai, Maharashtra 400054, India","Baby store","+91 99679 58204","400054","5","Maharashtra","ALIZA DIAPERS",
"Media Complex, St Paul, 24th Road, Bandra West, Mumbai, Maharashtra 400050, India","Children's store","+91 99872 91674","400050","39","Maharashtra","Pinklay Kids","https://www.pinklay.com/"
"Shop Number 3, Nari Seva Sadan Rd, Asalpha village, Ghatkopar West, Mumbai, Maharashtra 400084, India","Baby store","+91 99876 41437","400084","2","Maharashtra","Aadi Baby Care",
"nursing home, G5, swastik Chambers, Pipe Line Rd, below Kurla, Kurla West, Mumbai, Maharashtra 400070, India","Toy store","+91 70478 74787","400070","63","Maharashtra","ZIZI TOYS","https://mybillbook.in/store/zizi_toys"
